timestamp,source,text,rating_numerator,rating_denominator,name,dog_stage,jpg_url,img_num,p1,p1_conf,p1_dog,p2,p2_conf,p2_dog,p3,p3_conf,p3_dog,favorites,retweets
2016-11-08 22:25:27 +0000,"<a href=""http://twitter.com/download/iphone"" rel=""nofollow"">Twitter for iPhone</a>",I didn't believe it at first but now I can see that voter fraud is a serious h*ckin issue. 11/10 https://t.co/7i0bDMbrVN,11,10,,,https://pbs.twimg.com/media/CwxfrguUUAA1cbl.jpg,1,Cardigan,70.02,True,Pembroke,26.07,True,papillon,1.71,True,10139,2813
2016-11-08 20:00:55 +0000,"<a href=""http://twitter.com/download/iphone"" rel=""nofollow"">Twitter for iPhone</a>",This is Yogi. He's 98% floof. Snuggable af. 12/10 https://t.co/opoXKxmfFm,12,10,Yogi,,https://pbs.twimg.com/media/Cww-msrXcAAxm3K.jpg,1,chow,97.38,True,Tibetan_mastiff,1.41,True,gibbon,0.24,False,9469,2703
2016-11-08 16:47:50 +0000,"<a href=""http://twitter.com/download/iphone"" rel=""nofollow"">Twitter for iPhone</a>",This is Daisy. She's here to make your day better. 13/10 mission h*ckin successful https://t.co/PbgvuD0qIL,13,10,Daisy,,https://pbs.twimg.com/media/CwwSaWJWIAASuoY.jpg,1,golden_retriever,89.38,True,Labrador_retriever,7.01,True,doormat,0.84,False,12071,4284
2016-11-07 03:14:10 +0000,"<a href=""http://twitter.com/download/iphone"" rel=""nofollow"">Twitter for iPhone</a>",Elder doggo does a splash. Both 13/10 incredible stuff https://t.co/gBUDjdEcqz,13,10,,doggo,https://pbs.twimg.com/ext_tw_video_thumb/795464066940764160/pu/img/jPkMMQXdydb7CqFX.jpg,1,golden_retriever,19.31,True,Chesapeake_Bay_retriever,15.79,True,soft-coated_wheaten_terrier,12.47,True,55683,27728
2016-11-06 22:59:35 +0000,"<a href=""http://twitter.com/download/iphone"" rel=""nofollow"">Twitter for iPhone</a>",This is Brody. He's trying to make the same face as the football. 12/10 https://t.co/2H4MfOGlpQ,12,10,Brody,,https://pbs.twimg.com/media/CwnUUGTWIAE8sFR.jpg,2,golden_retriever,92.55,True,Labrador_retriever,5.92,True,tennis_ball,0.45,False,11270,3323
2016-11-06 01:33:58 +0000,"<a href=""http://twitter.com/download/iphone"" rel=""nofollow"">Twitter for iPhone</a>",This is Bailey. She loves going down slides but is very bad at it. Still 11/10 https://t.co/ivPWhspN3E,11,10,Bailey,,https://pbs.twimg.com/media/CwiuEJmW8AAZnit.jpg,2,gas_pump,67.64,False,harvester,5.0,False,swing,4.47,False,18139,6288
2016-11-05 15:37:24 +0000,"<a href=""http://twitter.com/download/iphone"" rel=""nofollow"">Twitter for iPhone</a>",This is Mack. He's rather h*ckin sleepy. Exceptional ears. 12/10 would boop https://t.co/XRPvTPF0VH,12,10,Mack,,https://pbs.twimg.com/media/CwglhZVXgAAc3_w.jpg,1,teddy,56.96,False,bath_towel,17.37,False,toy_poodle,3.77,True,11492,2697
2016-11-04 00:15:59 +0000,"<a href=""http://twitter.com/download/iphone"" rel=""nofollow"">Twitter for iPhone</a>",This is Nimbus (like the cloud). He just bought this fancy af duck raincoat. Only protects one ear tho. 12/10 so h*ckin floofy https://t.co/SIQbb8c3AU,12,10,Nimbus,,https://pbs.twimg.com/media/CwYJBiHXgAQlvrh.jpg,1,Samoyed,98.83,True,malamute,0.49,True,Great_Pyrenees,0.29,True,10686,3088
2016-11-03 15:51:10 +0000,"<a href=""http://twitter.com/download/iphone"" rel=""nofollow"">Twitter for iPhone</a>",This is Laika. She was a space pupper. The first space pupper actually. Orbited earth like a h*ckin boss. 14/10 hero af https://t.co/trSjgY3h4g,14,10,Laika,pupper,https://pbs.twimg.com/media/CwWVe_3WEAAHAvx.jpg,3,pedestal,66.27,False,fountain,29.48,False,brass,2.04,False,10314,3895
2016-11-02 23:45:19 +0000,"<a href=""http://twitter.com/download/iphone"" rel=""nofollow"">Twitter for iPhone</a>",This is Maximus. His face is stuck like that. Tragic really. Great tongue tho. 12/10 would pet firmly https://t.co/xIfrsMNLBR,12,10,Maximus,,https://pbs.twimg.com/media/CwS4aqZXUAAe3IO.jpg,1,Labrador_retriever,86.17,True,golden_retriever,4.45,True,Staffordshire_bullterrier,1.65,True,18910,5711
2016-11-02 16:00:06 +0000,"<a href=""http://twitter.com/download/iphone"" rel=""nofollow"">Twitter for iPhone</a>",This is Clark. He was just caught wearing pants. 13/10 game-changing af https://t.co/2Xo19aPrG5,13,10,Clark,,https://pbs.twimg.com/media/CwRN8H6WgAASe4X.jpg,1,Old_English_sheepdog,76.53,True,Bedlington_terrier,11.28,True,Kerry_blue_terrier,4.77,True,10295,2187
2016-11-01 23:53:02 +0000,"<a href=""http://twitter.com/download/iphone"" rel=""nofollow"">Twitter for iPhone</a>",This is Dobby. I can't stop looking at her feet. 12/10 would absolutely snug https://t.co/LhzPWv6rTv,12,10,Dobby,,https://pbs.twimg.com/media/CwNwmxvXEAEJ54Z.jpg,1,miniature_pinscher,53.9,True,Chihuahua,21.78,True,toy_terrier,8.91,True,8926,1908
2016-11-01 17:12:16 +0000,"<a href=""http://twitter.com/download/iphone"" rel=""nofollow"">Twitter for iPhone</a>",This is Fiona. She's an extremely mediocre copilot. Very distracting. Wink makes up for all the missed turns. 12/10 https://t.co/aF5MmpvPqN,12,10,Fiona,,https://pbs.twimg.com/media/CwMU34YWIAAz1nU.jpg,2,golden_retriever,32.61,True,Labrador_retriever,21.99,True,Chesapeake_Bay_retriever,16.34,True,11953,2786
2016-11-01 03:00:09 +0000,"<a href=""http://twitter.com/download/iphone"" rel=""nofollow"">Twitter for iPhone</a>",This is Moreton. He's the Good Boy Who Lived. 13/10 magical as h*ck https://t.co/rLHGx3VAF3,13,10,Moreton,,https://pbs.twimg.com/media/CwJR1okWIAA6XMp.jpg,1,Afghan_hound,27.46,True,borzoi,14.22,True,doormat,10.97,False,27597,10723
2016-11-01 02:00:14 +0000,"<a href=""http://twitter.com/download/iphone"" rel=""nofollow"">Twitter for iPhone</a>",Meet Dave. It's his favorite day of the year. He gets to fulfill his dream of being a dinosaur. 12/10 inspirational af https://t.co/MgQSdfZGPN,12,10,Dave,,https://pbs.twimg.com/media/CwJEIKTWYAAvL-T.jpg,1,Siberian_husky,23.17,True,Eskimo_dog,20.67,True,Pembroke,7.01,True,9677,2763
2016-11-01 01:00:05 +0000,"<a href=""http://twitter.com/download/iphone"" rel=""nofollow"">Twitter for iPhone</a>",Oh h*ck look at this spookling right here. Fright level off the charts. 12/10 sufficiently spooked https://t.co/BNy9IIJMb0,12,10,,,https://pbs.twimg.com/media/CwI2XCvXEAEO8mc.jpg,1,basset,20.76,True,Walker_hound,6.06,True,beagle,4.12,True,22350,9714
2016-11-01 00:00:38 +0000,"<a href=""http://twitter.com/download/iphone"" rel=""nofollow"">Twitter for iPhone</a>",This is Tucker. He's out here bustin h*ckin ghosts. 13/10 dedicated af https://t.co/Ap477GhwXt,13,10,Tucker,,https://pbs.twimg.com/media/CwIougTWcAAMLyq.jpg,1,golden_retriever,55.93,True,Labrador_retriever,39.02,True,cocker_spaniel,3.63,True,11780,3812
2016-10-31 23:00:11 +0000,"<a href=""http://twitter.com/download/iphone"" rel=""nofollow"">Twitter for iPhone</a>","This is Juno. She spooked me up real good, but only to get my attention. Above average handwriting for a dog I think. 11/10 https://t.co/hFxxBCWlwj",11,10,Juno,,https://pbs.twimg.com/media/CwIa5CjW8AErZgL.jpg,1,wire-haired_fox_terrier,45.6,True,Lakeland_terrier,27.34,True,English_springer,8.36,True,11001,3338
2016-10-31 22:00:04 +0000,"<a href=""http://twitter.com/download/iphone"" rel=""nofollow"">Twitter for iPhone</a>",This is Maude. She's the h*ckin happiest wasp you've ever seen. 10/10 would pet with caution https://t.co/etL8FHBrh8,10,10,Maude,,https://pbs.twimg.com/media/CwINKJeW8AYHVkn.jpg,1,doormat,87.44,False,French_bulldog,1.88,True,Boston_bull,1.51,True,9997,3301
2016-10-31 21:00:23 +0000,"<a href=""http://twitter.com/download/iphone"" rel=""nofollow"">Twitter for iPhone</a>",Say hello to Lily. She's pupset that her costume doesn't fit as well as last year. 12/10 poor puppo https://t.co/YSi6K1firY,12,10,Lily,puppo,https://pbs.twimg.com/media/CwH_foYWgAEvTyI.jpg,2,Labrador_retriever,65.48,True,golden_retriever,7.41,True,Chihuahua,4.23,True,17063,6547
2016-10-31 20:00:05 +0000,"<a href=""http://twitter.com/download/iphone"" rel=""nofollow"">Twitter for iPhone</a>",This is Newt. He's a strawberry. 11/10 https://t.co/2VhmlwxA1Q,11,10,Newt,,https://pbs.twimg.com/media/CwHxsdYVMAAqGCJ.jpg,1,Lakeland_terrier,26.68,True,Irish_terrier,21.88,True,Airedale,13.3,True,7740,2310
2016-10-31 19:00:10 +0000,"<a href=""http://twitter.com/download/iphone"" rel=""nofollow"">Twitter for iPhone</a>",This is Benji. He's Air Bud. It's a low effort costume but he pulls it off rather h*ckin well. 12/10 would happily get dunked on https://t.co/IbzT7DJvBo,12,10,Benji,,https://pbs.twimg.com/media/CwHj-jGWAAAnsny.jpg,1,golden_retriever,94.62,True,Labrador_retriever,3.65,True,doormat,0.24,False,10478,3238
2016-10-31 18:00:14 +0000,"<a href=""http://twitter.com/download/iphone"" rel=""nofollow"">Twitter for iPhone</a>",This is Nida. She's a free elf. Waited so long for this day. 11/10 https://t.co/3lE8Izgmkf,11,10,Nida,,https://pbs.twimg.com/media/CwHWOZ7W8AAHv8S.jpg,1,Italian_greyhound,19.39,True,bluetick,16.04,True,standard_poodle,12.6,True,6909,1984
2016-10-31 17:00:11 +0000,"<a href=""http://twitter.com/download/iphone"" rel=""nofollow"">Twitter for iPhone</a>",Your favorite squad is looking extra h*ckin spooky today. 13/10 for all https://t.co/PrgvOyPtDT,13,10,,,https://pbs.twimg.com/media/CwHIg61WIAApnEV.jpg,1,bakery,73.7,False,saltshaker,5.24,False,teddy,4.66,False,7214,2893
2016-10-31 16:00:13 +0000,"<a href=""http://twitter.com/download/iphone"" rel=""nofollow"">Twitter for iPhone</a>","This is Robin. She's desperately trying to do me a frighten, but her tongue drastically decreases her spook value. Still 11/10 great effort https://t.co/sxMrsOZ8zb",11,10,Robin,,https://pbs.twimg.com/media/CwG6zDfWcAA8jBD.jpg,1,Labrador_retriever,72.49,True,golden_retriever,16.97,True,kuvasz,3.55,True,14202,4551
2016-10-31 02:17:31 +0000,"<a href=""http://twitter.com/download/iphone"" rel=""nofollow"">Twitter for iPhone</a>",Here is a perfect example of someone who has their priorities in order. 13/10 for both owner and Forrest https://t.co/LRyMrU7Wfq,13,10,,,https://pbs.twimg.com/media/CwD-eCLWIAA6v0B.jpg,4,web_site,22.67,False,lighter,8.19,False,switch,3.9,False,16063,4715
2016-10-31 00:20:11 +0000,"<a href=""http://twitter.com/download/iphone"" rel=""nofollow"">Twitter for iPhone</a>",This is Bailey. She's rather h*ckin hype for Halloween tomorrow. Carved those pupkins herself. 12/10 https://t.co/v17mFm0Ftz,12,10,Bailey,,https://pbs.twimg.com/media/CwDjoH3WAAIniIs.jpg,3,jack-o'-lantern,99.93,False,basketball,0.01,False,standard_poodle,0.01,True,12666,4964
2016-10-30 17:02:53 +0000,"<a href=""http://twitter.com/download/iphone"" rel=""nofollow"">Twitter for iPhone</a>",This is Monster. Not an actual monster tho. He's showing you his tongue. Very impressive Monster. 12/10 would snug https://t.co/RhaPExuxJL,12,10,Monster,,https://pbs.twimg.com/media/CwB_i-zXEAEiP29.jpg,1,Yorkshire_terrier,91.28,True,silky_terrier,6.78,True,Australian_terrier,0.45,True,8209,1963
2016-10-29 15:55:58 +0000,"<a href=""http://twitter.com/download/iphone"" rel=""nofollow"">Twitter for iPhone</a>",Meet BeBe. She rocks the messy bun of your dreams. H*ckin flawless. 12/10 would watch her tutorial https://t.co/of0pFNBIl8,12,10,BeBe,,https://pbs.twimg.com/media/Cv8moW9W8AIHOxR.jpg,2,cocker_spaniel,74.64,True,Irish_setter,9.16,True,miniature_poodle,6.11,True,15128,4998
2016-10-28 17:07:05 +0000,"<a href=""http://twitter.com/download/iphone"" rel=""nofollow"">Twitter for iPhone</a>",This is Remus. He's a mop that came to life. Can't see anything. Constantly trips over himself. Still a very good dog. 11/10 https://t.co/S3f1SYylzu,11,10,Remus,,https://pbs.twimg.com/media/Cv3tU38WcAASFas.jpg,2,komondor,94.29,True,swab,5.27,False,Tibetan_terrier,0.27,True,8029,2088
2016-10-27 16:06:04 +0000,"<a href=""http://twitter.com/download/iphone"" rel=""nofollow"">Twitter for iPhone</a>",When she says you're a good boy and you know you're a good boy because you're a good boy. 13/10 https://t.co/O5IUmRHRIh,13,10,,,https://pbs.twimg.com/media/CvyVxQRWEAAdSZS.jpg,1,golden_retriever,70.51,True,Labrador_retriever,21.97,True,kuvasz,1.6,True,13129,3661
2016-10-26 22:31:36 +0000,"<a href=""http://twitter.com/download/iphone"" rel=""nofollow"">Twitter for iPhone</a>",Say hello to Levi. He's a Madagascan Butterbop. One of the more docile Butterbops I've seen. 12/10 would give all the pets https://t.co/Zcw9Sccctc,12,10,Levi,,https://pbs.twimg.com/media/CvukbEkWAAAV-69.jpg,4,Pembroke,97.26,True,Cardigan,2.7,True,basenji,0.02,True,14670,4797
2016-10-26 16:14:55 +0000,"<a href=""http://twitter.com/download/iphone"" rel=""nofollow"">Twitter for iPhone</a>",This is Mabel. She's super h*ckin smol. Portable af. Comes with the smol shoe. 12/10 would keep in frocket https://t.co/GGJvxYt3xK,12,10,Mabel,,https://pbs.twimg.com/media/CvtONV4WAAAQ3Rn.jpg,4,miniature_pinscher,89.29,True,toy_terrier,9.55,True,Doberman,0.35,True,9841,2963
2016-10-25 18:44:32 +0000,"<a href=""http://twitter.com/download/iphone"" rel=""nofollow"">Twitter for iPhone</a>",This is Misty. She has a cowboy hat on her nose. 12/10 https://t.co/Eno0mypHIr,12,10,Misty,,https://pbs.twimg.com/media/Cvom3ZJXEAE29TD.jpg,1,cocker_spaniel,34.92,True,flat-coated_retriever,30.95,True,Newfoundland,10.48,True,11089,2483
2016-10-25 16:00:09 +0000,"<a href=""http://twitter.com/download/iphone"" rel=""nofollow"">Twitter for iPhone</a>",This is Betty. She's assisting with the dishes. Such a good puppo. 12/10 h*ckin helpful af https://t.co/dgvTPZ9tgI,12,10,Betty,puppo,https://pbs.twimg.com/media/CvoBPWRWgAA4het.jpg,1,dishwasher,70.05,False,golden_retriever,24.58,True,chow,3.9,True,18601,5496
2016-10-24 23:37:28 +0000,"<a href=""http://twitter.com/download/iphone"" rel=""nofollow"">Twitter for iPhone</a>",This is Mosby. He appears to be rather h*ckin snuggable af. 12/10 keep it up Mosby https://t.co/IiiBq460I7,12,10,Mosby,,https://pbs.twimg.com/media/CvkgUjbUsAEvo7l.jpg,1,Bernese_mountain_dog,99.65,True,EntleBucher,0.11,True,Appenzeller,0.1,True,9158,2203
2016-10-24 15:53:19 +0000,"<a href=""http://twitter.com/download/iphone"" rel=""nofollow"">Twitter for iPhone</a>",This is Duke. He sneaks into the fridge sometimes. It's his safe place. 11/10 would give little jacket if necessary https://t.co/Fd5WFDTMH4,11,10,Duke,,https://pbs.twimg.com/media/Cvi2FiKWgAAif1u.jpg,2,refrigerator,99.89,False,malinois,0.02,True,kelpie,0.01,True,22473,8183
2016-10-23 23:42:19 +0000,"<a href=""http://twitter.com/download/iphone"" rel=""nofollow"">Twitter for iPhone</a>",Meet Maggie. She can hear your cells divide. 12/10 can also probably fly https://t.co/ovE2hqXryV,12,10,Maggie,,https://pbs.twimg.com/media/CvfX2AnWYAAQTay.jpg,1,Pembroke,65.88,True,Cardigan,15.31,True,toy_terrier,10.23,True,8740,2167
2016-10-23 19:42:02 +0000,"<a href=""http://twitter.com/download/iphone"" rel=""nofollow"">Twitter for iPhone</a>",This is Bruce. He never backs down from a challenge. 11/10 you got this Bruce https://t.co/aI7umZHIq7,11,10,Bruce,,https://pbs.twimg.com/media/Cveg1-NXgAASaaT.jpg,1,Labrador_retriever,42.77,True,Great_Dane,19.05,True,curly-coated_retriever,14.64,True,14081,3732
2016-10-23 00:27:05 +0000,"<a href=""http://twitter.com/download/iphone"" rel=""nofollow"">Twitter for iPhone</a>",This is Happy. He's a bathtub reviewer. Seems to be pleased with this one. 12/10 https://t.co/Ln89R4FP7v,12,10,Happy,,https://pbs.twimg.com/media/CvaYgDOWgAEfjls.jpg,1,tub,47.95,False,bathtub,32.51,False,golden_retriever,7.85,True,10369,2704
2016-10-22 00:45:17 +0000,"<a href=""http://twitter.com/download/iphone"" rel=""nofollow"">Twitter for iPhone</a>",This is Eli. He can fly. 13/10 magical af https://t.co/huPSJJ7FDI,13,10,Eli,,https://pbs.twimg.com/media/CvVTEnPXYAAWLyL.jpg,1,chow,26.07,True,cougar,8.81,False,Pomeranian,7.99,True,8448,2080
2016-10-21 22:48:24 +0000,"<a href=""http://twitter.com/download/iphone"" rel=""nofollow"">Twitter for iPhone</a>",This is Brownie. She's wearing a Halloween themed onesie. 12/10 festive af https://t.co/0R4meWXFOx,12,10,Brownie,,https://pbs.twimg.com/media/CvU4UZpXgAE1pAV.jpg,2,Chesapeake_Bay_retriever,87.88,True,beagle,1.86,True,Labrador_retriever,1.75,True,7620,2279
2016-10-21 18:16:44 +0000,"<a href=""http://twitter.com/download/iphone"" rel=""nofollow"">Twitter for iPhone</a>",This is Rizzy. She smiles a lot. 12/10 contagious af https://t.co/TU4sZogVIq,12,10,Rizzy,,https://pbs.twimg.com/media/CvT6IV6WEAQhhV5.jpg,3,schipperke,36.33,True,kelpie,19.7,True,Norwegian_elkhound,15.1,True,13188,3942
2016-10-21 00:53:56 +0000,"<a href=""http://twitter.com/download/iphone"" rel=""nofollow"">Twitter for iPhone</a>",This is Stella. She's happier than I will ever be. 10/10 would trade lives with https://t.co/JSs2bfDtTS,10,10,Stella,,https://pbs.twimg.com/media/CvQLdotWcAAZn86.jpg,1,malamute,81.29,True,Siberian_husky,12.09,True,Eskimo_dog,2.43,True,10196,3014
2016-10-20 16:15:26 +0000,"<a href=""http://twitter.com/download/iphone"" rel=""nofollow"">Twitter for iPhone</a>",This is Bo. He's a West Congolese Bugaboop Snuggle. Rather exotic. Master of the head tilt. 12/10 would pay to pet https://t.co/2jwxxtNzoN,12,10,Bo,,https://pbs.twimg.com/media/CvOUw8vWYAAzJDq.jpg,2,Chihuahua,74.61,True,Pekinese,7.04,True,Pembroke,4.92,True,10875,3244
2016-10-20 01:03:11 +0000,"<a href=""http://twitter.com/download/iphone"" rel=""nofollow"">Twitter for iPhone</a>","This is Lucy. She destroyed not one, but two remotes trying to turn off the debate. 11/10 relatable af https://t.co/3BXh073tDm",11,10,Lucy,,https://pbs.twimg.com/media/CvLD-mbWYAAFI8w.jpg,1,remote_control,88.15,False,oscilloscope,3.55,False,golden_retriever,3.41,True,30653,14409
2016-10-19 15:37:03 +0000,"<a href=""http://twitter.com/download/iphone"" rel=""nofollow"">Twitter for iPhone</a>",This is Butter. She can have whatever she wants forever. 12/10 would hug softly https://t.co/x5gXRS1abq,12,10,Butter,,https://pbs.twimg.com/media/CvJCabcWgAIoUxW.jpg,1,cocker_spaniel,50.05,True,golden_retriever,27.27,True,jigsaw_puzzle,4.15,False,30658,12014
2016-10-18 16:11:17 +0000,"<a href=""http://twitter.com/download/iphone"" rel=""nofollow"">Twitter for iPhone</a>",This is Dexter. He breaks hearts for a living. 11/10 h*ckin handsome af https://t.co/4DhSsC1W7S,11,10,Dexter,,https://pbs.twimg.com/media/CvEAqQoWgAADj5K.jpg,1,golden_retriever,80.52,True,Labrador_retriever,11.38,True,Brittany_spaniel,3.86,True,16060,5990
2016-10-18 00:41:57 +0000,"<a href=""http://twitter.com/download/iphone"" rel=""nofollow"">Twitter for iPhone</a>",Atlas is back and this time he's got doggles. Still 13/10 solarly conscious af https://t.co/s7MgFWDySc,13,10,,,https://pbs.twimg.com/media/CvAr88kW8AEKNAO.jpg,2,Samoyed,73.55,True,Pomeranian,7.51,True,Arctic_fox,3.61,False,8100,2488
2016-10-17 22:51:57 +0000,"<a href=""http://twitter.com/download/iphone"" rel=""nofollow"">Twitter for iPhone</a>",This is Leo. He's a golden chow. Rather h*ckin rare. 13/10 would give extra pats https://t.co/xosHjFzVXc,13,10,Leo,,https://pbs.twimg.com/media/CvASw6dWcAQmo3X.jpg,3,chow,81.41,True,Pomeranian,11.27,True,Chihuahua,1.59,True,6865,1510
2016-10-17 15:31:05 +0000,"<a href=""http://twitter.com/download/iphone"" rel=""nofollow"">Twitter for iPhone</a>",Did... did they pick out that license plate? 12/10 for both https://t.co/lRmUUOxgbQ,12,10,,,https://pbs.twimg.com/media/Cu-t20yWEAAFHXi.jpg,1,beach_wagon,36.29,False,minivan,30.48,False,limousine,10.17,False,6867,1535
2016-10-17 00:20:47 +0000,"<a href=""http://twitter.com/download/iphone"" rel=""nofollow"">Twitter for iPhone</a>",This is Frank. He wears sunglasses and walks himself. 11/10 I'll never be this cool or independent https://t.co/pNNjBtHWPc,11,10,Frank,,https://pbs.twimg.com/media/Cu7dg2RXYAIaGXE.jpg,2,pug,36.28,True,French_bulldog,22.19,True,English_setter,8.04,True,9717,3540
2016-10-16 18:11:26 +0000,"<a href=""http://twitter.com/download/iphone"" rel=""nofollow"">Twitter for iPhone</a>",This is Tonks. She is a service puppo. Can hear a caterpillar hiccup from 7 miles away. 13/10 would follow anywhere https://t.co/i622ZbWkUp,13,10,Tonks,puppo,https://pbs.twimg.com/media/Cu6I9vvWIAAZG0a.jpg,3,German_shepherd,99.23,True,malinois,0.49,True,kelpie,0.09,True,11416,3240
2016-10-15 21:01:17 +0000,"<a href=""http://twitter.com/download/iphone"" rel=""nofollow"">Twitter for iPhone</a>",This is Moose. He's rather h*ckin dangerous (you can tell by the collar). 11/10 would still attempt to snug https://t.co/lHVHGdDzb3,11,10,Moose,,https://pbs.twimg.com/media/Cu1mQsDWEAAU_VQ.jpg,1,Chihuahua,90.05,True,toy_terrier,2.11,True,miniature_pinscher,1.95,True,12120,3300
2016-10-15 16:01:13 +0000,"<a href=""http://twitter.com/download/iphone"" rel=""nofollow"">Twitter for iPhone</a>",This is Lincoln. He forgot to use his blinker when he changed lanes just now. Guilty as h*ck. Still 10/10 https://t.co/lsrR83SiVp,10,10,Lincoln,,https://pbs.twimg.com/media/Cu0hlfwWYAEdnXO.jpg,1,seat_belt,74.77,False,golden_retriever,10.57,True,dingo,1.73,False,8726,2032
2016-10-14 16:13:10 +0000,"<a href=""http://twitter.com/download/iphone"" rel=""nofollow"">Twitter for iPhone</a>",This is Rory. He's got an interview in a few minutes. Looking spiffy af. Nervous as h*ck tho. 12/10 would hire https://t.co/ibj5g6xaAj,12,10,Rory,,https://pbs.twimg.com/media/Cuvau3MW8AAxaRv.jpg,1,golden_retriever,91.53,True,Saluki,4.62,True,Labrador_retriever,3.75,True,29725,9327
2016-10-13 23:23:56 +0000,"<a href=""http://twitter.com/download/iphone"" rel=""nofollow"">Twitter for iPhone</a>","This is Logan, the Chow who lived. He solemnly swears he's up to lots of good. H*ckin magical af 9.75/10 https://t.co/yBO5wuqaPS",75,10,Logan,,https://pbs.twimg.com/media/CurzvFTXgAA2_AP.jpg,1,Pomeranian,46.73,True,Persian_cat,12.3,False,chow,10.27,True,20296,7069
2016-10-13 20:28:35 +0000,"<a href=""http://twitter.com/download/iphone"" rel=""nofollow"">Twitter for iPhone</a>","""Honestly Kathleen I just want more Ken Bone"" 12/10 https://t.co/HmlEvAMP4r",12,10,,,https://pbs.twimg.com/media/CurLmoqXgAEPoJ-.jpg,1,Leonberg,51.2,True,keeshond,46.48,True,Pomeranian,0.78,True,11957,2996
2016-10-13 15:54:28 +0000,"<a href=""http://twitter.com/download/iphone"" rel=""nofollow"">Twitter for iPhone</a>",This is Dale. He's a real spookster. Did me quite the frighten. 11/10 not too spooky to pet tho https://t.co/L8BWDD4oBX,11,10,Dale,,https://pbs.twimg.com/media/CuqM0fVWAAAboKR.jpg,1,Pembroke,70.95,True,Cardigan,28.72,True,chow,0.06,True,10497,3601
2016-10-13 00:29:39 +0000,"<a href=""http://twitter.com/download/iphone"" rel=""nofollow"">Twitter for iPhone</a>",This is Rizzo. He has many talents. A true renaissance doggo. 13/10 entertaining af https://t.co/TVXpEJB7Wn,13,10,Rizzo,doggo,https://pbs.twimg.com/media/Cum5LlfWAAAyPcS.jpg,1,golden_retriever,92.93,True,Labrador_retriever,6.29,True,Saluki,0.22,True,12189,4072
2016-10-12 15:55:59 +0000,"<a href=""http://twitter.com/download/iphone"" rel=""nofollow"">Twitter for iPhone</a>",This is Mattie. She's extremely dangerous. Will bite your h*ckin finger right off. Still 11/10 would pet with caution https://t.co/78c9W8kLFh,11,10,Mattie,,https://pbs.twimg.com/media/CulDnZpWcAAGbZ-.jpg,1,Labrador_retriever,47.82,True,schipperke,22.48,True,Staffordshire_bullterrier,7.74,True,17178,5571
2016-10-11 19:39:28 +0000,"<a href=""http://twitter.com/download/iphone"" rel=""nofollow"">Twitter for iPhone</a>",This is Lucy. She's strives to be the best potato she can be. 12/10 would boop https://t.co/lntsj7Fc4Y,12,10,Lucy,,https://pbs.twimg.com/media/CugtKeXWEAAamDZ.jpg,1,teddy,97.21,False,toy_poodle,0.85,True,chow,0.29,True,12696,3652
2016-10-11 16:00:24 +0000,"<a href=""http://twitter.com/download/iphone"" rel=""nofollow"">Twitter for iPhone</a>",Meet Rusty. He appears to be rather h*ckin fluffy. Also downright adorable af. 12/10 would rub my face against his https://t.co/1j9kLGb4wV,12,10,Rusty,,https://pbs.twimg.com/ext_tw_video_thumb/785872596088811520/pu/img/5O-_BgqdFQu_2Bt7.jpg,1,Great_Pyrenees,39.21,True,golden_retriever,19.84,True,Pekinese,14.33,True,7489,2130
2016-10-11 00:34:48 +0000,"<a href=""http://twitter.com/download/iphone"" rel=""nofollow"">Twitter for iPhone</a>",This is Pinot. He's a sophisticated doggo. You can tell by the hat. Also pointier than your average pupper. Still 10/10 would pet cautiously https://t.co/f2wmLZTPHd,10,10,Pinot,doggopupper,https://pbs.twimg.com/media/CucnLmeWAAALOSC.jpg,1,porcupine,97.8,False,sea_urchin,0.61,False,echidna,0.54,False,8735,2561
2016-10-10 17:32:08 +0000,"<a href=""http://twitter.com/download/iphone"" rel=""nofollow"">Twitter for iPhone</a>",This is Dallas. Her tongue is ridiculous. 11/10 h*ckin proud af https://t.co/h4jhlH4EyG,11,10,Dallas,,https://pbs.twimg.com/media/CubGchjXEAA6gpw.jpg,2,miniature_pinscher,43.6,True,black-and-tan_coonhound,25.8,True,Rottweiler,14.52,True,10183,2334
2016-10-09 23:44:41 +0000,"<a href=""http://twitter.com/download/iphone"" rel=""nofollow"">Twitter for iPhone</a>",This is Doc. He requested to be carried around like that. 12/10 anything for Doc https://t.co/mWYACm4qnx,12,10,Doc,,https://pbs.twimg.com/media/CuXSHNnWcAIWEwn.jpg,1,teddy,67.49,False,cradle,5.67,False,chow,5.61,True,8128,1911
2016-10-09 17:31:53 +0000,"<a href=""http://twitter.com/download/iphone"" rel=""nofollow"">Twitter for iPhone</a>",This is Hero. He was enjoying the car ride until he remembered that bees are dying globally at an alarming rate. 11/10 https://t.co/cubFg7F4qQ,11,10,Hero,,https://pbs.twimg.com/media/CuV8yfxXEAAUlye.jpg,2,seat_belt,89.12,False,Eskimo_dog,2.75,True,Samoyed,1.95,True,13491,5639
2016-10-08 18:41:19 +0000,"<a href=""http://twitter.com/download/iphone"" rel=""nofollow"">Twitter for iPhone</a>",This is Rusty. He's going D1 for sure. Insane vertical. 13/10 would draft https://t.co/AsykOwMrXQ,13,10,Rusty,,https://pbs.twimg.com/media/CuRDF-XWcAIZSer.jpg,1,chow,9.03,True,binoculars,8.35,False,Irish_setter,7.75,True,11310,3712
