timestamp,source,text,rating_numerator,rating_denominator,name,dog_stage,jpg_url,img_num,p1,p1_conf,p1_dog,p2,p2_conf,p2_dog,p3,p3_conf,p3_dog,favorites,retweets
2015-12-15 17:42:34 +0000,"<a href=""http://twitter.com/download/iphone"" rel=""nofollow"">Twitter for iPhone</a>",Watch out Airbud. This pupper is also good at the sports. 12/10 I'm thinking D1 https://t.co/1HrFdo7M0C,12,10,,pupper,https://pbs.twimg.com/media/CWSL4W8WsAAE4KU.jpg,2,rain_barrel,62.56,False,barrel,13.84,False,Labrador_retriever,3.95,True,1957,741
2015-12-15 17:11:09 +0000,"<a href=""http://twitter.com/download/iphone"" rel=""nofollow"">Twitter for iPhone</a>",Say hello to Penny &amp; Gizmo. They are practicing their caroling. The ambition in the room is tangible. 9/10 for both https://t.co/aqBHjjh5VD,9,10,Penny,,https://pbs.twimg.com/media/CWSEsO9WwAAX-fZ.jpg,1,Chihuahua,44.09,True,Pomeranian,34.58,True,cocker_spaniel,6.03,True,1536,469
2015-12-15 14:50:49 +0000,"<a href=""http://twitter.com/download/iphone"" rel=""nofollow"">Twitter for iPhone</a>","When someone yells ""cops!"" at a party and you gotta get your drunk friend out of there. 10/10 https://t.co/4rMZi5Ca1k",10,10,,,https://pbs.twimg.com/ext_tw_video_thumb/676776408941662209/pu/img/k-6I3YEZAQtYPBXR.jpg,1,doormat,20.13,False,dishwasher,19.17,False,microwave,3.81,False,5405,2249
2015-12-15 04:19:18 +0000,"<a href=""http://twitter.com/download/iphone"" rel=""nofollow"">Twitter for iPhone</a>",I promise this wasn't meant to be a cuteness overload account but ermergerd look at this cozy pupper. 13/10 https://t.co/mpQl2rJjDh,13,10,,pupper,https://pbs.twimg.com/media/CWPUB9TWwAALPPx.jpg,1,Chihuahua,84.11,True,Pomeranian,12.05,True,Pekinese,0.66,True,3149,1108
2015-12-15 04:05:01 +0000,"<a href=""http://twitter.com/download/iphone"" rel=""nofollow"">Twitter for iPhone</a>",This is the saddest/sweetest/best picture I've been sent. 12/10 ðŸ˜¢ðŸ¶ https://t.co/vQ2Lw1BLBF,12,10,,,https://pbs.twimg.com/media/CWPQwmJWUAAu_At.jpg,1,book_jacket,49.38,False,Doberman,9.64,True,miniature_pinscher,7.06,True,1183,219
2015-12-15 03:36:42 +0000,"<a href=""http://twitter.com/download/iphone"" rel=""nofollow"">Twitter for iPhone</a>",*screeches for a sec and then faints* 12/10 https://t.co/N5QL4ySBEx,12,10,,,https://pbs.twimg.com/media/CWPKSGpWcAQN6mw.jpg,1,Loafer,20.3,False,doormat,20.04,False,malinois,14.23,True,2039,490
2015-12-15 03:23:14 +0000,"<a href=""http://twitter.com/download/iphone"" rel=""nofollow"">Twitter for iPhone</a>",This is Godzilla pupper. He had a ruff childhood &amp; now deflects that pain outward by terrorizing cities. Tragic 9/10 https://t.co/g1tLGkyaxr,9,10,Godzilla,pupper,https://pbs.twimg.com/media/CWPHMqKVAAAE78E.jpg,1,whippet,87.7,True,Great_Dane,3.42,True,boxer,2.84,True,1280,440
2015-12-15 02:23:26 +0000,"<a href=""http://twitter.com/download/iphone"" rel=""nofollow"">Twitter for iPhone</a>",This is Bubbles. He kinda resembles a fish. Always makes eye contact with u no matter what. Sneaky tongue slip. 5/10 https://t.co/Nrhvc5tLFT,5,10,Bubbles,,https://pbs.twimg.com/media/CWO5gmCUYAAX4WA.jpg,1,Boston_bull,97.66,True,French_bulldog,1.43,True,Chihuahua,0.23,True,2533,896
2015-12-15 02:02:01 +0000,"<a href=""http://twitter.com/download/iphone"" rel=""nofollow"">Twitter for iPhone</a>","Meet Vinnie. He's having fun while being safe. Well not a lot of fun, but definitely safe, and that's important 8/10 https://t.co/vZYtynZZlH",8,10,Vinnie,,https://pbs.twimg.com/media/CWO0m8tUwAAB901.jpg,1,seat_belt,79.0,False,Boston_bull,19.63,True,French_bulldog,1.24,True,1310,312
2015-12-15 01:32:24 +0000,"<a href=""http://twitter.com/download/iphone"" rel=""nofollow"">Twitter for iPhone</a>",This pupper is very passionate about Christmas. Wanted to give the tree a hug. So cute. 8/10 https://t.co/NsGyECJuq7,8,10,,pupper,https://pbs.twimg.com/media/CWOt07EUsAAnOYW.jpg,1,feather_boa,42.41,False,Yorkshire_terrier,7.31,True,Shetland_sheepdog,5.76,True,2807,1254
2015-12-14 22:46:41 +0000,"<a href=""http://twitter.com/download/iphone"" rel=""nofollow"">Twitter for iPhone</a>",ITSOFLUFFAYYYYY 12/10 https://t.co/bfw13CnuuZ,12,10,,,https://pbs.twimg.com/media/CWOH4s9U8AEtkmQ.jpg,1,chow,26.53,True,ice_bear,16.76,False,fur_coat,11.75,False,2025,621
2015-12-14 20:17:59 +0000,"<a href=""http://twitter.com/download/iphone"" rel=""nofollow"">Twitter for iPhone</a>",Say hello to Griffin. He's upset because his costume for Halloween didn't arrive until today. 9/10 cheer up pup https://t.co/eoBCjSFajX,9,10,Griffin,,https://pbs.twimg.com/media/CWNl3S9WcAARN34.jpg,1,pug,98.54,True,Norwegian_elkhound,0.44,True,French_bulldog,0.39,True,1641,602
2015-12-14 18:35:43 +0000,"<a href=""http://twitter.com/download/iphone"" rel=""nofollow"">Twitter for iPhone</a>",Three generations of pupper. 11/10 for all https://t.co/tAmQYvzrau,11,10,,pupper,https://pbs.twimg.com/media/CWNOdIpWoAAWid2.jpg,1,golden_retriever,79.04,True,borzoi,2.29,True,dingo,1.53,False,12616,5224
2015-12-14 16:34:00 +0000,"<a href=""http://twitter.com/download/iphone"" rel=""nofollow"">Twitter for iPhone</a>",Hope your Monday isn't too awful. Here's two baseball puppers. 11/10 for each https://t.co/dB0H9hdZai,11,10,,,https://pbs.twimg.com/media/CWMyl9EWUAAnZJ0.jpg,2,Maltese_dog,57.95,True,toy_poodle,13.34,True,Shih-Tzu,9.44,True,1863,748
2015-12-14 15:57:56 +0000,"<a href=""http://twitter.com/download/iphone"" rel=""nofollow"">Twitter for iPhone</a>","Meet Duke. He's an Urban Parmesan. They know he's scared of the green rubber dog. ""Why u do dis?"" thinks Duke. 10/10 https://t.co/3bim9U5Idr",10,10,Duke,,https://pbs.twimg.com/media/CWMqV7WUYAEEClG.jpg,1,golden_retriever,58.39,True,cocker_spaniel,20.37,True,Labrador_retriever,3.61,True,1526,385
2015-12-14 04:52:55 +0000,"<a href=""http://twitter.com/download/iphone"" rel=""nofollow"">Twitter for iPhone</a>",All this pupper wanted to do was go skiing. No one told him about the El NiÃ±o. Poor pupper. 10/10 maybe next year https://t.co/fTgbq1UBR9,10,10,,pupper,https://pbs.twimg.com/media/CWKSIfUUYAAiOBO.jpg,1,teddy,9.83,False,toy_poodle,9.8,True,shopping_basket,7.79,False,2243,609
2015-12-14 03:08:46 +0000,"<a href=""http://twitter.com/download/iphone"" rel=""nofollow"">Twitter for iPhone</a>",Say hello to Winston. He has no respect for the system. Much rebellion. I think that's a palm tree... nice. 8/10 https://t.co/dOLQddhXLZ,8,10,Winston,,https://pbs.twimg.com/media/CWJ6Sc-WwAAlpI6.jpg,1,French_bulldog,96.2,True,Chihuahua,2.18,True,Boston_bull,0.69,True,1335,331
2015-12-14 01:58:31 +0000,"<a href=""http://twitter.com/download/iphone"" rel=""nofollow"">Twitter for iPhone</a>",This is Kenneth. He's stuck in a bubble. 10/10 hang in there Kenneth https://t.co/uQt37xlYMJ,10,10,Kenneth,,https://pbs.twimg.com/media/CWJqN9iWwAAg86R.jpg,1,bubble,99.76,False,leafhopper,0.02,False,whippet,0.01,True,67100,31989
2015-12-14 01:43:35 +0000,"<a href=""http://twitter.com/download/iphone"" rel=""nofollow"">Twitter for iPhone</a>",This is Herm. He just wants to be like the other dogs. Sneaky tongue slip. Super fuzzy. 9/10 would cuddle firmly https://t.co/tg8h9lzCHv,9,10,Herm,,https://pbs.twimg.com/media/CWJmzNsWUAE706Z.jpg,1,hamster,99.95,False,guinea_pig,0.02,False,broccoli,0.01,False,1881,661
2015-12-14 00:07:50 +0000,"<a href=""http://twitter.com/download/iphone"" rel=""nofollow"">Twitter for iPhone</a>",These two pups just met and have instantly bonded. Spectacular scene. Mesmerizing af. 10/10 and 7/10 for blue dog https://t.co/gwryaJO4tC,10,10,,,https://pbs.twimg.com/media/CWJQ4UmWoAIJ29t.jpg,2,Chihuahua,37.67,True,Italian_greyhound,17.31,True,muzzle,7.15,False,2478,1145
2015-12-13 21:07:04 +0000,"<a href=""http://twitter.com/download/iphone"" rel=""nofollow"">Twitter for iPhone</a>",This is Bert. He likes flowers. 10/10 https://t.co/lmQRrNxaQu,10,10,Bert,,https://pbs.twimg.com/media/CWIngp5WEAAJOy3.jpg,1,Irish_water_spaniel,38.83,True,standard_poodle,28.41,True,greenhouse,3.49,False,2077,744
2015-12-13 18:10:33 +0000,"<a href=""http://twitter.com/download/iphone"" rel=""nofollow"">Twitter for iPhone</a>",Meet Striker. He's ready for Christmas. 11/10 https://t.co/B3xxSLjQSH,11,10,Striker,,https://pbs.twimg.com/media/CWH_FTgWIAAwOUy.jpg,1,Shih-Tzu,22.58,True,Norfolk_terrier,18.69,True,Irish_terrier,10.7,True,3042,1284
2015-12-13 17:57:57 +0000,"<a href=""http://twitter.com/download/iphone"" rel=""nofollow"">Twitter for iPhone</a>",Extremely rare pup here. Very religious. Always praying. Too many legs. Not overwhelmingly fluffy. Won't bark. 3/10 https://t.co/REyE5YKVBb,3,10,,,https://pbs.twimg.com/media/CWH8L72UkAAvjql.jpg,1,walking_stick,16.22,False,sandal,12.91,False,purse,8.14,False,3279,1623
2015-12-13 17:21:08 +0000,"<a href=""http://twitter.com/download/iphone"" rel=""nofollow"">Twitter for iPhone</a>","""Yes hello I'ma just snag this here toasted bagel real quick. carry on."" 9/10 https://t.co/Cuz0Osnekp",9,10,,,https://pbs.twimg.com/media/CWHzzFGXIAA0Y_H.jpg,1,bull_mastiff,74.38,True,boxer,10.67,True,American_Staffordshire_terrier,4.23,True,1431,483
2015-12-13 04:40:46 +0000,"<a href=""http://twitter.com/download/iphone"" rel=""nofollow"">Twitter for iPhone</a>",I'm sure you've all seen this pupper. Not prepared at all for the flying disc of terror. 10/10 https://t.co/G0pQiFGM7O,10,10,,pupper,https://pbs.twimg.com/media/CWFFt3_XIAArIYK.jpg,1,Labrador_retriever,40.74,True,malinois,7.7,True,pug,7.46,True,1774,653
2015-12-13 04:14:39 +0000,"<a href=""http://twitter.com/download/iphone"" rel=""nofollow"">Twitter for iPhone</a>",This is Donny. He's summoning the demon monster Babadook. 6/10 Donny please no that won't be a good time for anyone https://t.co/kiW6Knb7Gp,6,10,Donny,,https://pbs.twimg.com/media/CWE_x33UwAEE3no.jpg,1,Italian_greyhound,30.56,True,whippet,23.21,True,Great_Dane,11.78,True,2297,976
2015-12-13 04:02:03 +0000,"<a href=""http://twitter.com/download/iphone"" rel=""nofollow"">Twitter for iPhone</a>",Breathtaking scene. A father taking care of his newborn pup. Tugs at the heartstrings. 10/10 restores my faith https://t.co/06oZdehGEa,10,10,,,https://pbs.twimg.com/media/CWE85snWIAEG5ES.jpg,1,West_Highland_white_terrier,67.21,True,Old_English_sheepdog,14.61,True,komondor,2.31,True,2581,1067
2015-12-13 03:21:34 +0000,"<a href=""http://twitter.com/download/iphone"" rel=""nofollow"">Twitter for iPhone</a>","Ok, I'll admit this is a pretty adorable bunny hopping towards the ocean but please only send in dogs... 11/10 https://t.co/sfsVCGIipI",11,10,,,https://pbs.twimg.com/media/CWEzo19WoAEiOCj.jpg,1,wood_rabbit,78.58,False,hare,11.82,False,Cardigan,4.36,True,4531,1570
2015-12-13 02:51:51 +0000,"<a href=""http://twitter.com/download/iphone"" rel=""nofollow"">Twitter for iPhone</a>",&amp; this is Yoshi. Another world record contender 11/10 (what the hell is happening why are there so many contenders?) https://t.co/QG708dDNH6,11,10,,,https://pbs.twimg.com/media/CWEs1b-WEAEhq82.jpg,1,golden_retriever,26.39,True,Welsh_springer_spaniel,18.42,True,beagle,18.22,True,1783,632
2015-12-13 01:41:41 +0000,"<a href=""http://twitter.com/download/iphone"" rel=""nofollow"">Twitter for iPhone</a>",Here we have an entire platoon of puppers. Total score: 88/80 would pet all at once https://t.co/y93p6FLvVw,88,80,,,https://pbs.twimg.com/media/CWEcxqWVEAAHyGH.jpg,1,Labrador_retriever,86.84,True,golden_retriever,4.33,True,vizsla,2.82,True,2927,1460
2015-12-13 01:12:15 +0000,"<a href=""http://twitter.com/download/iphone"" rel=""nofollow"">Twitter for iPhone</a>","This is Pepper. She's not fully comfortable riding her imaginary bike yet. 10/10 don't worry pupper, it gets easier https://t.co/40dj4eTsXG",10,10,Pepper,pupper,https://pbs.twimg.com/media/CWEWClfW4AAnqhG.jpg,1,pug,88.4,True,Boston_bull,1.11,True,French_bulldog,0.98,True,2477,1000
2015-12-12 23:41:18 +0000,"<a href=""http://twitter.com/download/iphone"" rel=""nofollow"">Twitter for iPhone</a>",ðŸŽ¶ HELLO FROM THE OTHER SIIIIIIIIDE ðŸŽ¶ 10/10s https://t.co/GK2HJtkdQk,10,10,,,https://pbs.twimg.com/media/CWEBOFYWwAA-O2c.jpg,1,Pomeranian,46.07,True,chow,20.28,True,Pekinese,13.33,True,1652,591
2015-12-12 23:34:00 +0000,"<a href=""http://twitter.com/download/iphone"" rel=""nofollow"">Twitter for iPhone</a>",Here's a handful of sleepy puppers. All look unaware of their surroundings. Lousy guard dogs. Still cute tho 11/10s https://t.co/lyXX3v5j4s,11,10,,,https://pbs.twimg.com/media/CWD_jQMWEAAdYwH.jpg,1,basset,55.64,True,beagle,20.17,True,bloodhound,11.08,True,1140,260
2015-12-12 22:04:39 +0000,"<a href=""http://twitter.com/download/iphone"" rel=""nofollow"">Twitter for iPhone</a>",This is Bernie. He just touched a boob for the first time. 10/10 https://t.co/whQKMygnK6,10,10,Bernie,,https://pbs.twimg.com/media/CWDrGH4UYAARoq_.jpg,1,beagle,68.12,True,basset,12.51,True,boxer,8.04,True,11101,3787
2015-12-12 20:57:34 +0000,"<a href=""http://twitter.com/download/iphone"" rel=""nofollow"">Twitter for iPhone</a>",Say hello to Buddah. He was Waldo for Halloween. 11/10 https://t.co/DVAqAnb624,11,10,Buddah,,https://pbs.twimg.com/media/CWDbv2yU4AARfeH.jpg,1,Maltese_dog,92.2,True,West_Highland_white_terrier,1.78,True,toy_poodle,1.36,True,1750,537
2015-12-12 18:13:51 +0000,"<a href=""http://twitter.com/download/iphone"" rel=""nofollow"">Twitter for iPhone</a>",Here's a pupper licking in slow motion. 12/10 please enjoy https://t.co/AUJi8ujxw9,12,10,,pupper,https://pbs.twimg.com/ext_tw_video_thumb/675740268751138818/pu/img/dVaVeFAVT-lk_1ZV.jpg,1,golden_retriever,80.05,True,kuvasz,9.78,True,Saluki,6.84,True,1257,388
2015-12-12 16:16:45 +0000,"<a href=""http://twitter.com/download/iphone"" rel=""nofollow"">Twitter for iPhone</a>",This is Lenny. He was just told that he couldn't explore the fish tank. 12/10 smh all that work for nothing https://t.co/JWi6YrpiO1,12,10,Lenny,,https://pbs.twimg.com/media/CWCbd8ZWoAAtqoH.jpg,2,standard_schnauzer,44.14,True,miniature_schnauzer,24.89,True,Sealyham_terrier,16.5,True,2046,928
2015-12-12 16:02:36 +0000,"<a href=""http://twitter.com/download/iphone"" rel=""nofollow"">Twitter for iPhone</a>",We've got ourselves a battle here. Watch out Reggie. 11/10 https://t.co/ALJvbtcwf0,11,10,,,https://pbs.twimg.com/media/CWCYOqWUAAARmGr.jpg,1,bath_towel,72.19,False,Staffordshire_bullterrier,5.93,True,bagel,3.57,False,2154,771
2015-12-12 15:59:51 +0000,"<a href=""http://twitter.com/download/iphone"" rel=""nofollow"">Twitter for iPhone</a>",This is a Sizzlin Menorah spaniel from Brooklyn named Wylie. Lovable eyes. Chiller as hell. 10/10 and I'm out.. poof https://t.co/7E0AiJXPmI,10,10,,,https://pbs.twimg.com/media/CWCXj35VEAIFvtk.jpg,1,English_springer,99.03,True,Welsh_springer_spaniel,0.21,True,cocker_spaniel,0.2,True,693,106
2015-12-12 04:35:48 +0000,"<a href=""http://twitter.com/download/iphone"" rel=""nofollow"">Twitter for iPhone</a>",Seriously guys?! Only send in dogs. I only rate dogs. This is a baby black bear... 11/10 https://t.co/H7kpabTfLj,11,10,,,https://pbs.twimg.com/media/CV_7CV6XIAEV05u.jpg,1,chow,74.94,True,schipperke,13.37,True,Newfoundland,4.99,True,1953,470
2015-12-12 04:23:49 +0000,"<a href=""http://twitter.com/download/iphone"" rel=""nofollow"">Twitter for iPhone</a>",This is Ellie AKA Queen Slayer of the Orbs. Very self-motivated. Great yard. Rad foliage. 10/10 would pet diligently https://t.co/c9jmg3Xtzn,10,10,Ellie,,https://pbs.twimg.com/media/CV_4ShmUYAA3wNu.jpg,1,Pembroke,91.84,True,Cardigan,2.73,True,Siberian_husky,2.02,True,1276,428
2015-12-12 03:47:46 +0000,"<a href=""http://twitter.com/download/iphone"" rel=""nofollow"">Twitter for iPhone</a>",Meet Sammy. He's a Motorola Firefox. Hat under hoodie (must be a half-decent up and coming white rapper) 10/10 https://t.co/rO2zxf0OQ0,10,10,Sammy,,https://pbs.twimg.com/media/CV_wCh8W4AEWWZ9.jpg,1,cocker_spaniel,29.97,True,golden_retriever,26.37,True,Irish_setter,8.03,True,1122,316
2015-12-12 03:29:35 +0000,"<a href=""http://twitter.com/download/iphone"" rel=""nofollow"">Twitter for iPhone</a>",12/10 stay woke https://t.co/XDiQw4Akiw,12,10,,,https://pbs.twimg.com/media/CV_r3v4VAAALvwg.jpg,1,Scottish_deerhound,24.06,True,groenendael,15.69,True,flat-coated_retriever,9.09,True,1414,507
2015-12-12 02:23:01 +0000,"<a href=""http://twitter.com/download/iphone"" rel=""nofollow"">Twitter for iPhone</a>","I shall call him squishy and he shall be mine, and he shall be my squishy. 13/10 https://t.co/WId5lxNdPH",13,10,,,https://pbs.twimg.com/media/CV_cnjHWUAADc-c.jpg,1,dough,80.68,False,bakery,2.79,False,French_loaf,1.82,False,18482,6485
2015-12-12 02:07:14 +0000,"<a href=""http://twitter.com/download/iphone"" rel=""nofollow"">Twitter for iPhone</a>",Meet Reggie. He's going for the world record. Must concentrate. Focus up pup. 11/10 we all believe in you Reggie https://t.co/h3AWz4AzuC,11,10,Reggie,,https://pbs.twimg.com/media/CV_ZAhcUkAUeKtZ.jpg,1,vizsla,51.96,True,miniature_pinscher,6.48,True,Rhodesian_ridgeback,6.15,True,3397,1443
2015-12-12 01:38:53 +0000,"<a href=""http://twitter.com/download/iphone"" rel=""nofollow"">Twitter for iPhone</a>",RT until we find this dog. Clearly a cool dog (front leg relaxed out window). Looks to be a superb driver. 10/10 https://t.co/MnTrKaQ8Wn,10,10,,,https://pbs.twimg.com/media/CV_SimUWoAAvJSY.jpg,1,West_Highland_white_terrier,13.96,True,seat_belt,11.86,False,Old_English_sheepdog,9.4,True,1406,672
2015-12-12 01:12:54 +0000,"<a href=""http://twitter.com/download/iphone"" rel=""nofollow"">Twitter for iPhone</a>",Rare shielded battle dog here. Very happy about abundance of lettuce. Painfully slow fetcher. Still petable. 5/10 https://t.co/C3tlKVq7eO,5,10,,,https://pbs.twimg.com/media/CV_MmGZU8AAggM6.jpg,1,box_turtle,54.37,False,terrapin,20.26,False,loggerhead,7.11,False,1985,1081
2015-12-11 21:51:30 +0000,"<a href=""http://twitter.com/download/iphone"" rel=""nofollow"">Twitter for iPhone</a>",Happy Friday. Here's some golden puppers. 12/10 for all https://t.co/wNkqAED6lG,12,10,,,https://pbs.twimg.com/media/CV-ef64WoAAbh0I.jpg,1,Labrador_retriever,98.65,True,golden_retriever,0.89,True,Chihuahua,0.07,True,1623,627
2015-12-11 17:51:04 +0000,"<a href=""http://twitter.com/download/iphone"" rel=""nofollow"">Twitter for iPhone</a>","The tail alone is 13/10. Great dog, better owner https://t.co/IyAXinfyju",13,10,,,https://pbs.twimg.com/media/CV9nd30XAAAEba5.jpg,1,Chihuahua,41.64,True,West_Highland_white_terrier,10.29,True,Samoyed,8.73,True,1838,563
2015-12-11 17:12:48 +0000,"<a href=""http://twitter.com/download/iphone"" rel=""nofollow"">Twitter for iPhone</a>",This is Daisy. She loves that shoe. Still no seat belt. Super churlish. 12/10 the dogs are killing it today https://t.co/cZlkvgRPdn,12,10,Daisy,,https://pbs.twimg.com/media/CV9etctWUAAl5Hp.jpg,1,Labrador_retriever,47.9,True,ice_bear,21.83,False,kuvasz,13.99,True,1136,262
2015-12-11 16:40:19 +0000,"<a href=""http://twitter.com"" rel=""nofollow"">Twitter Web Client</a>",Everyone needs to watch this. 13/10 https://t.co/Bb3xnpsWBC,13,10,,,https://pbs.twimg.com/ext_tw_video_thumb/675354114423808004/pu/img/qL1R_nGLqa6lmkOx.jpg,1,upright,30.34,False,golden_retriever,18.14,True,Brittany_spaniel,16.21,True,35178,18963
2015-12-11 16:20:15 +0000,"<a href=""http://twitter.com/download/iphone"" rel=""nofollow"">Twitter for iPhone</a>",Yea I lied. Here's more. All 13/10 https://t.co/ZQZf2U4xCP,13,10,,,https://pbs.twimg.com/media/CV9SrABU4AQI46z.jpg,3,borzoi,86.64,True,Saluki,12.21,True,Irish_wolfhound,0.4,True,4237,2532
2015-12-11 15:19:21 +0000,"<a href=""http://twitter.com/download/iphone"" rel=""nofollow"">Twitter for iPhone</a>",Good morning here's a grass pupper. 12/10 https://t.co/2d68FmWGGs,12,10,,pupper,https://pbs.twimg.com/media/CV9EvZNUwAAgLCK.jpg,2,Pembroke,77.31,True,Cardigan,11.68,True,chow,3.9,True,3007,1436
2015-12-11 04:14:49 +0000,"<a href=""http://twitter.com/download/iphone"" rel=""nofollow"">Twitter for iPhone</a>",This is Arnold. He broke his leg saving a handicapped child from a forest fire. True hero. 10/10 inspirational dog https://t.co/bijCeHeX4C,10,10,Arnold,,https://pbs.twimg.com/media/CV6spB7XAAIpMyP.jpg,1,llama,28.44,False,standard_poodle,13.26,True,teddy,12.8,False,3920,1795
2015-12-11 03:21:23 +0000,"<a href=""http://twitter.com/download/iphone"" rel=""nofollow"">Twitter for iPhone</a>",What kind of person sends in a picture without a dog in it? 1/10 just because that's a nice table https://t.co/RDXCfk8hK0,1,10,,,https://pbs.twimg.com/media/CV6gaUUWEAAnETq.jpg,1,paper_towel,32.8,False,mailbox,9.6,False,seat_belt,3.5,False,6072,2734
2015-12-11 03:05:37 +0000,"<a href=""http://twitter.com/download/iphone"" rel=""nofollow"">Twitter for iPhone</a>",holy shit 12/10 https://t.co/p6O8X93bTQ,12,10,,,https://pbs.twimg.com/media/CV6czeEWEAEdChp.jpg,1,chow,99.99,True,Tibetan_mastiff,0.01,True,Tibetan_terrier,0.0,True,4037,1878
2015-12-11 02:56:28 +0000,"<a href=""http://twitter.com/download/iphone"" rel=""nofollow"">Twitter for iPhone</a>",When you're presenting a group project and the 4th guy tells the teacher that he did all the work. 10/10 https://t.co/f50mbB4UWS,10,10,,,https://pbs.twimg.com/media/CV6atgoWcAEsdv6.jpg,1,golden_retriever,94.92,True,Labrador_retriever,1.68,True,flat-coated_retriever,1.06,True,1026,273
2015-12-11 02:54:12 +0000,"<a href=""http://twitter.com/download/iphone"" rel=""nofollow"">Twitter for iPhone</a>",This is Coops. He's yelling at the carpet. Not very productive Coops. 7/10 https://t.co/Uz52oYnHzF,7,10,Coops,,https://pbs.twimg.com/media/CV6aMToXIAA7kH4.jpg,1,dingo,28.84,False,Cardigan,22.99,True,Pembroke,19.04,True,1300,349
2015-12-11 02:49:59 +0000,"<a href=""http://twitter.com/download/iphone"" rel=""nofollow"">Twitter for iPhone</a>",What an honor. 3 dogs here. Blond one is clearly a gymnast. Other two just confused. Very nifty pups. 9/10 for all https://t.co/YDgstgIDGs,9,10,,,https://pbs.twimg.com/media/CV6ZOPqWsAA20Uj.jpg,1,Labrador_retriever,45.87,True,Great_Dane,23.55,True,Staffordshire_bullterrier,11.69,True,2305,1011
2015-12-11 02:08:58 +0000,"<a href=""http://twitter.com/download/iphone"" rel=""nofollow"">Twitter for iPhone</a>",This is Steven. He got locked outside. Damn it Steven. 5/10 nice grill tho https://t.co/zf7Sxxjfp3,5,10,Steven,,https://pbs.twimg.com/media/CV6P1lnWIAAUQHk.jpg,1,stove,58.75,False,rotisserie,5.17,False,microwave,2.07,False,1398,542
2015-12-11 00:44:07 +0000,"<a href=""http://twitter.com/download/iphone"" rel=""nofollow"">Twitter for iPhone</a>",Meet Zuzu. He just graduated college. Astute pupper. Needs 2 leashes to contain him. Wasn't ready for the pic. 10/10 https://t.co/2H5SKmk0k7,10,10,Zuzu,pupper,https://pbs.twimg.com/media/CV58a4nXAAApywo.jpg,1,bow,16.8,False,quill,10.88,False,joystick,4.33,False,2120,877
2015-12-11 00:35:44 +0000,"<a href=""http://twitter.com/download/iphone"" rel=""nofollow"">Twitter for iPhone</a>",Say hello to Oliver. He thought what was inside the pillow should be outside the pillow. Blurry since birth. 8/10 https://t.co/lFU9W31Fg9,8,10,Oliver,,https://pbs.twimg.com/media/CV56f54WsAEv4kJ.jpg,1,Labrador_retriever,63.15,True,Brittany_spaniel,10.19,True,Chesapeake_Bay_retriever,6.26,True,1042,283
2015-12-11 00:26:12 +0000,"<a href=""http://twitter.com/download/iphone"" rel=""nofollow"">Twitter for iPhone</a>",C'mon guys. We've been over this. We only rate dogs. This is a cow. Please only submit dogs. Thank you...... 9/10 https://t.co/WjcELNEqN2,9,10,,,https://pbs.twimg.com/media/CV54UQTXAAAGf-j.jpg,1,dalmatian,98.95,True,English_setter,0.53,True,German_short-haired_pointer,0.14,True,3006,1259
2015-12-10 20:19:52 +0000,"<a href=""http://twitter.com/download/iphone"" rel=""nofollow"">Twitter for iPhone</a>",This is a fluffy albino Bacardi Columbia mix. Excellent at the tweets. 11/10 would hug gently https://t.co/diboDRUuEI,11,10,,,https://pbs.twimg.com/media/CV4_8FgXAAQOj4S.jpg,1,Samoyed,97.8,True,chow,0.71,True,Pomeranian,0.64,True,1141,366
2015-12-10 18:12:05 +0000,"<a href=""http://twitter.com/download/iphone"" rel=""nofollow"">Twitter for iPhone</a>",Meet Moe. He's a golden Fetty Woof. Doesn't respect the authorities. Might own a motorhome? 10/10 revolutionary pup https://t.co/JAncIdNp8G,10,10,Moe,,https://pbs.twimg.com/media/CV4iqh5WcAEV1E6.jpg,1,street_sign,29.01,False,golden_retriever,25.84,True,sandbar,13.22,False,2918,1335
2015-12-10 17:37:00 +0000,"<a href=""http://twitter.com/download/iphone"" rel=""nofollow"">Twitter for iPhone</a>",Say hello to Mollie. This pic was taken after she bet all her toys on Ronda Rousey. 10/10 hang in there pupper https://t.co/QMmAqA9VqO,10,10,Mollie,pupper,https://pbs.twimg.com/media/CV4aqCwWsAIi3OP.jpg,1,boxer,65.47,True,space_heater,4.34,False,beagle,4.28,True,1057,252
2015-12-10 17:24:21 +0000,"<a href=""http://twitter.com/download/iphone"" rel=""nofollow"">Twitter for iPhone</a>",Meet Laela. She's adorable. Magnificent eyes. But I don't see a seat belt. Insubordinate.. and churlish. Still 12/10 https://t.co/pCGDgLkLo6,12,10,Laela,,https://pbs.twimg.com/media/CV4XwYiWoAAHQIF.jpg,1,Pembroke,65.53,True,Pomeranian,10.42,True,Cardigan,5.28,True,1672,517
2015-12-10 17:11:09 +0000,"<a href=""http://twitter.com/download/iphone"" rel=""nofollow"">Twitter for iPhone</a>",Ok last one of these. I may try to make some myself. Anyway here ya go. 13/10 https://t.co/i9CDd1oEu8,13,10,,,https://pbs.twimg.com/media/CV4UvgNUkAEEnZd.jpg,1,Rottweiler,59.18,True,Doberman,20.45,True,black-and-tan_coonhound,7.86,True,2433,1232
2015-12-10 04:18:42 +0000,"<a href=""http://twitter.com/download/iphone"" rel=""nofollow"">Twitter for iPhone</a>","When your entire life is crumbling before you and you're trying really hard to hold your shit together.
10/10 https://t.co/vqFkgYPCW8",10,10,,,https://pbs.twimg.com/ext_tw_video_thumb/674805331965399040/pu/img/-7bw8niVrgIkLKOW.jpg,1,English_springer,59.45,True,cocker_spaniel,39.0,True,Welsh_springer_spaniel,0.71,True,934,391
