timestamp,source,text,rating_numerator,rating_denominator,name,dog_stage,jpg_url,img_num,p1,p1_conf,p1_dog,p2,p2_conf,p2_dog,p3,p3_conf,p3_dog,favorites,retweets
2016-04-05 18:41:02 +0000,"<a href=""http://twitter.com/download/iphone"" rel=""nofollow"">Twitter for iPhone</a>",This is Ebby. She's a Zimbabwean Feta. Embarrassed by ridiculously squishy face. 9/10 would squeeze softly https://t.co/LBJqxMGaHi,9,10,Ebby,,https://pbs.twimg.com/media/CfTLUYWXEAEkyES.jpg,2,miniature_pinscher,28.65,True,Italian_greyhound,8.41,True,beagle,6.47,True,3446,945
2016-04-04 17:53:31 +0000,"<a href=""http://twitter.com/download/iphone"" rel=""nofollow"">Twitter for iPhone</a>",This is FlÃ¡vio (pronounced Baxter). He's a Benesnoop Cumberdog. Super rare. Symmetrical. 12/10 would pet so well https://t.co/fGgleFiBPq,12,10,FlÃ¡vio,,https://pbs.twimg.com/media/CfN23ArXEAEkZkz.jpg,1,golden_retriever,98.35,True,Labrador_retriever,1.22,True,cocker_spaniel,0.24,True,6826,2135
2016-04-04 15:22:08 +0000,"<a href=""http://twitter.com/download/iphone"" rel=""nofollow"">Twitter for iPhone</a>",This is Smokey. He's having some sort of existential crisis. 10/10 hang in there pupper https://t.co/JmgF4dMpw0,10,10,Smokey,pupper,https://pbs.twimg.com/media/CfNUNetW8AAekHx.jpg,1,Siberian_husky,50.62,True,Eskimo_dog,26.97,True,malamute,6.07,True,3583,1102
2016-04-04 01:41:58 +0000,"<a href=""http://twitter.com/download/iphone"" rel=""nofollow"">Twitter for iPhone</a>",This is Link. He struggles with couches. 10/10 would assist https://t.co/SbX4e6Yg3o,10,10,Link,,https://pbs.twimg.com/media/CfKYfeBXIAAopp2.jpg,2,malinois,61.96,True,Leonberg,11.81,True,bull_mastiff,6.65,True,4627,1317
2016-04-04 00:55:01 +0000,"<a href=""http://twitter.com/download/iphone"" rel=""nofollow"">Twitter for iPhone</a>",Meet Jennifur. She's supposed to be navigating. Not even buckled up. Insubordinate &amp; churlish. 11/10 would still pet https://t.co/h0trcJohYO,11,10,Jennifur,,https://pbs.twimg.com/media/CfKNvU8WsAAvI9Z.jpg,1,Pomeranian,46.88,True,seat_belt,15.47,False,golden_retriever,12.5,True,5204,1474
2016-04-03 01:36:11 +0000,"<a href=""http://twitter.com/download/iphone"" rel=""nofollow"">Twitter for iPhone</a>",This is Bluebert. He just saw that both #FinalFur match ups are split 50/50. Amazed af. 11/10 https://t.co/Kky1DPG4iq,50,50,Bluebert,,https://pbs.twimg.com/media/CfFNk7cWAAA-hND.jpg,1,Siberian_husky,39.65,True,malamute,31.71,True,Eskimo_dog,27.34,True,2574,247
2016-04-02 15:25:47 +0000,"<a href=""http://twitter.com/download/iphone"" rel=""nofollow"">Twitter for iPhone</a>",This is Stephanus. She stays woke. 12/10 https://t.co/WIWabMngQZ,12,10,Stephanus,,https://pbs.twimg.com/media/CfDB3aJXEAAEZNv.jpg,1,Yorkshire_terrier,43.04,True,silky_terrier,19.68,True,cairn,7.27,True,3041,1225
2016-04-02 01:52:38 +0000,"<a href=""http://twitter.com/download/iphone"" rel=""nofollow"">Twitter for iPhone</a>",Here's a super majestic doggo and a sunset 11/10 https://t.co/UACnoyi8zu,11,10,,doggo,https://pbs.twimg.com/media/CfAHv83UMAIEQYx.jpg,1,golden_retriever,63.86,True,chow,25.47,True,Tibetan_mastiff,7.17,True,5272,1935
2016-04-01 15:46:52 +0000,"<a href=""http://twitter.com/download/iphone"" rel=""nofollow"">Twitter for iPhone</a>",This is Bubbles. He's a Yorkshire Piccolope. 11/10 would snug aggressively https://t.co/3BhMojONxq,11,10,Bubbles,,https://pbs.twimg.com/media/Ce99GhLW8AAHG38.jpg,1,pug,97.67,True,French_bulldog,1.97,True,bull_mastiff,0.23,True,3485,987
2016-04-01 02:51:22 +0000,"<a href=""http://twitter.com/download/iphone"" rel=""nofollow"">Twitter for iPhone</a>",This is a taco. We only rate dogs. Please only send in dogs. Dogs are what we rate. Not tacos. Thank you... 10/10 https://t.co/cxl6xGY8B9,10,10,,,https://pbs.twimg.com/media/Ce7LlUeUUAEQkQl.jpg,1,Dandie_Dinmont,74.02,True,miniature_poodle,8.19,True,toy_poodle,6.37,True,5093,1920
2016-04-01 00:26:15 +0000,"<a href=""http://twitter.com/download/iphone"" rel=""nofollow"">Twitter for iPhone</a>",Meet Toby. He's a Lithuanian High-Steppin Stickeroo. One of the more accomplished Stickeroos around. 10/10 so nifty https://t.co/cYPHuJYTjC,10,10,Toby,,https://pbs.twimg.com/media/Ce6qZC2WAAAcSoI.jpg,1,Staffordshire_bullterrier,42.78,True,pug,22.14,True,French_bulldog,13.21,True,4257,1454
2016-03-31 23:22:53 +0000,"<a href=""http://twitter.com/download/iphone"" rel=""nofollow"">Twitter for iPhone</a>",This is Zeus. He's downright fabulous. 12/10 https://t.co/sSugyyRuTp,12,10,Zeus,,https://pbs.twimg.com/media/Ce6b4MPWwAA22Xm.jpg,1,golden_retriever,99.07,True,Labrador_retriever,0.22,True,chow,0.12,True,4719,1813
2016-03-31 02:09:32 +0000,"<a href=""http://twitter.com/download/iphone"" rel=""nofollow"">Twitter for iPhone</a>",This is Bertson. He just wants to say hi. 11/10 would boop nose https://t.co/hwv7Wq6gDA,11,10,Bertson,,https://pbs.twimg.com/media/Ce14cOvWwAAcFJH.jpg,1,nail,85.56,False,screw,7.33,False,padlock,2.4,False,5955,1772
2016-03-31 00:58:29 +0000,"<a href=""http://twitter.com/download/iphone"" rel=""nofollow"">Twitter for iPhone</a>",This is Oscar. He's a world renowned snowball inspector. It's a ruff job but someone has to do it. 10/10 great guy https://t.co/vSufMAKm3C,10,10,Oscar,,https://pbs.twimg.com/media/Ce1oLNqWAAE34w7.jpg,1,West_Highland_white_terrier,59.71,True,soft-coated_wheaten_terrier,14.3,True,Lakeland_terrier,13.67,True,3294,768
2016-03-30 16:52:36 +0000,"<a href=""http://twitter.com/download/iphone"" rel=""nofollow"">Twitter for iPhone</a>",This is Nico. His selfie game is strong af. Excellent use of a sneaky tongue slip. 10/10 star material https://t.co/1OBdJkMOFx,10,10,Nico,,https://pbs.twimg.com/media/Cez49UqWsAIRQXc.jpg,1,Chihuahua,58.4,True,Italian_greyhound,37.71,True,Boston_bull,1.74,True,2630,736
2016-03-30 15:34:51 +0000,"<a href=""http://twitter.com/download/iphone"" rel=""nofollow"">Twitter for iPhone</a>",This is Michelangelope. He's half coffee cup. Rare af. 12/10 would hug until someone stopped me https://t.co/tvVDY0G911,12,10,Michelangelope,,https://pbs.twimg.com/media/CeznK6IWEAEFUPq.jpg,1,Chihuahua,95.68,True,beagle,0.84,True,Labrador_retriever,0.83,True,5578,2110
2016-03-30 02:56:24 +0000,"<a href=""http://twitter.com/download/iphone"" rel=""nofollow"">Twitter for iPhone</a>",This is Siba. She's remarkably mobile. Very sleepy as well. 12/10 would happily transport https://t.co/TjnI33RE1i,12,10,Siba,,https://pbs.twimg.com/media/Cew5kyOWsAA8Y_o.jpg,1,dingo,31.09,False,Chihuahua,14.23,True,Cardigan,10.39,True,4550,1392
2016-03-30 01:07:18 +0000,"<a href=""http://twitter.com/download/iphone"" rel=""nofollow"">Twitter for iPhone</a>",This is Calbert. He forgot to clear his Google search history. 9/10 rookie mistake Calbert https://t.co/jRm5J3YCmj,9,10,Calbert,,https://pbs.twimg.com/media/CewgnHAXEAAdbld.jpg,1,Brittany_spaniel,94.44,True,beagle,2.54,True,Ibizan_hound,1.0,True,4094,1166
2016-03-29 23:29:14 +0000,"<a href=""http://twitter.com/download/iphone"" rel=""nofollow"">Twitter for iPhone</a>",This is Curtis. He's an Albino Haberdasher. Terrified of dandelions. They really spook him up. 10/10 it'll be ok pup https://t.co/s8YcfZrWhK,10,10,Curtis,,https://pbs.twimg.com/media/CewKKiOWwAIe3pR.jpg,1,Great_Pyrenees,25.15,True,Samoyed,13.93,True,kuvasz,12.9,True,4503,1595
2016-03-29 01:53:39 +0000,"<a href=""http://twitter.com/download/iphone"" rel=""nofollow"">Twitter for iPhone</a>",This is Benedict. He's a feisty pup. Needs a brushing. Portable af. Looks very angry actually. 4/10 might not pet https://t.co/3oeFfHjv0Z,4,10,Benedict,,https://pbs.twimg.com/media/CerhoBWWAAA5eLL.jpg,1,meerkat,14.35,False,weasel,11.74,False,black-footed_ferret,9.99,False,3571,1122
2016-03-29 00:12:05 +0000,"<a href=""http://twitter.com/download/iphone"" rel=""nofollow"">Twitter for iPhone</a>",Here are two lil cuddly puppers. Both 12/10 would snug like so much https://t.co/zO4eb7C4tG,12,10,,,https://pbs.twimg.com/media/CerKYG8WAAM1aE-.jpg,1,Norfolk_terrier,29.3,True,Labrador_retriever,25.62,True,golden_retriever,12.96,True,3938,1038
2016-03-28 01:10:13 +0000,"<a href=""http://twitter.com/download/iphone"" rel=""nofollow"">Twitter for iPhone</a>","Meet Travis and Flurp. Travis is pretty chill but Flurp can't lie down properly. 10/10 &amp; 8/10
get it together Flurp https://t.co/Akzl5ynMmE",10,10,Travis,,https://pbs.twimg.com/media/CemOGNjWQAEoN7R.jpg,1,collie,17.68,True,Chesapeake_Bay_retriever,10.18,True,beagle,10.13,True,3281,808
2016-03-28 00:43:43 +0000,"<a href=""http://twitter.com/download/iphone"" rel=""nofollow"">Twitter for iPhone</a>",This is Thumas. He hates potted plants. 8/10 wtf Thumas https://t.co/rDVueNIcEi,8,10,Thumas,,https://pbs.twimg.com/media/CemIBt4WwAQqhVV.jpg,2,soft-coated_wheaten_terrier,75.2,True,Bedlington_terrier,17.57,True,Great_Pyrenees,1.15,True,3570,940
2016-03-27 22:14:49 +0000,"<a href=""http://twitter.com/download/iphone"" rel=""nofollow"">Twitter for iPhone</a>",Happy Easter from the squad! ðŸ‡ðŸ¶ 13/10 for all https://t.co/YMx4KWJUAB,13,10,,,https://pbs.twimg.com/media/Cell8ikWIAACCJ-.jpg,1,pug,53.4,True,bloodhound,16.48,True,German_shepherd,4.65,True,2480,990
2016-03-27 17:25:54 +0000,"<a href=""http://twitter.com/download/iphone"" rel=""nofollow"">Twitter for iPhone</a>","I know we only rate dogs, but since it's Easter I guess we could rate a bunny for a change. 10/10 petable as hell https://t.co/O2RlKXigHu",10,10,,,https://pbs.twimg.com/media/Cekj0qwXEAAHcS6.jpg,1,Labrador_retriever,58.7,True,golden_retriever,37.88,True,redbone,0.36,True,4673,1569
2016-03-27 02:43:58 +0000,"<a href=""http://twitter.com/download/iphone"" rel=""nofollow"">Twitter for iPhone</a>",This is Kanu. He's a Freckled Ticonderoga. Simply flawless. 12/10 would perform an elaborate heist to capture https://t.co/7vyAzIURrE,12,10,Kanu,,https://pbs.twimg.com/media/CehZ9mLWsAAsn28.jpg,1,Siberian_husky,46.32,True,Eskimo_dog,39.0,True,malamute,9.8,True,3564,869
2016-03-27 01:29:02 +0000,"<a href=""http://twitter.com/download/iphone"" rel=""nofollow"">Twitter for iPhone</a>",Happy Saturday here's 9 puppers on a bench. 99/90 good work everybody https://t.co/mpvaVxKmc1,99,90,,,https://pbs.twimg.com/media/CehIzzZWQAEyHH5.jpg,1,golden_retriever,37.18,True,cocker_spaniel,17.74,True,Irish_setter,9.27,True,3062,829
2016-03-26 16:15:05 +0000,"<a href=""http://twitter.com/download/iphone"" rel=""nofollow"">Twitter for iPhone</a>",This is Piper. She would really like that tennis ball core. Super sneaky tongue slip. 12/10 precious af https://t.co/QP6GHi5az9,12,10,Piper,,https://pbs.twimg.com/media/CefKBOuWIAAIlKD.jpg,1,Brittany_spaniel,79.79,True,English_springer,4.47,True,Welsh_springer_spaniel,3.79,True,5308,1541
2016-03-25 17:03:49 +0000,"<a href=""http://twitter.com/download/iphone"" rel=""nofollow"">Twitter for iPhone</a>",Here we see an extremely rare Bearded Floofmallow. Only a few left in the wild. 11/10 would pet with a purpose https://t.co/jVJJKlPbvq,11,10,,,https://pbs.twimg.com/media/CeaLlAPUMAIcC7U.jpg,1,Great_Pyrenees,72.03,True,Samoyed,12.95,True,kuvasz,12.25,True,4802,1440
2016-03-25 01:35:51 +0000,"<a href=""http://twitter.com/download/iphone"" rel=""nofollow"">Twitter for iPhone</a>",This is Lance. Lance doesn't give a shit. 10/10 we should all be more like Lance https://t.co/SqnG9Ap28J,10,10,Lance,,https://pbs.twimg.com/media/CeW3MWMWQAEOMbq.jpg,1,whippet,73.42,True,basenji,2.59,True,Great_Dane,2.59,True,7854,3183
2016-03-25 01:29:21 +0000,"<a href=""http://twitter.com/download/iphone"" rel=""nofollow"">Twitter for iPhone</a>",Say hello to Opie and Clarkus. Clarkus fell asleep so Opie buried him. Ruthless af 10/10 for both https://t.co/xT7XaY4gnW,10,10,Opie,,https://pbs.twimg.com/media/CeW1tERWAAAA9Q2.jpg,1,timber_wolf,50.38,False,malamute,43.06,True,Siberian_husky,2.85,True,4851,1630
2016-03-24 01:11:29 +0000,"<a href=""http://twitter.com/download/iphone"" rel=""nofollow"">Twitter for iPhone</a>",This is Stubert. He just arrived. 10/10 https://t.co/HVGs5aAKAn,10,10,Stubert,,https://pbs.twimg.com/media/CeRoBaxWEAABi0X.jpg,1,Labrador_retriever,86.87,True,carton,9.51,False,pug,0.77,True,20378,7602
2016-03-23 19:09:09 +0000,"<a href=""http://twitter.com/download/iphone"" rel=""nofollow"">Twitter for iPhone</a>",Please don't send in any more polar bears. We only rate dogs. Thank you... 10/10 https://t.co/83RGhdIQz2,10,10,,,https://pbs.twimg.com/media/CeQVF1eVIAAJaTv.jpg,1,Great_Pyrenees,73.2,True,kuvasz,12.14,True,Irish_wolfhound,4.95,True,13474,5616
2016-03-23 15:53:42 +0000,"<a href=""http://twitter.com/download/iphone"" rel=""nofollow"">Twitter for iPhone</a>",Say hello to Sunny and Roxy. They pull things out of water together. 10/10 for both https://t.co/88aedAmxcl,10,10,Sunny,,https://pbs.twimg.com/media/CePoVTyWsAQEz1g.jpg,1,Labrador_retriever,82.91,True,golden_retriever,3.87,True,Chihuahua,2.62,True,4531,1367
2016-03-23 00:37:48 +0000,"<a href=""http://twitter.com/download/iphone"" rel=""nofollow"">Twitter for iPhone</a>",This is Kane. He's a semi-submerged Haitian Huffleplop. Happy af. Sick waterfall. 11/10 would pat head approvingly https://t.co/7zjEC501Ul,11,10,Kane,,https://pbs.twimg.com/media/CeMWubMWwAA6GwF.jpg,1,ice_bear,86.95,False,Great_Pyrenees,6.95,True,Labrador_retriever,2.47,True,5799,1756
2016-03-22 02:03:52 +0000,"<a href=""http://twitter.com/download/iphone"" rel=""nofollow"">Twitter for iPhone</a>",I can't even comprehend how confused this dog must be right now. 10/10 https://t.co/8AGcQ4hIfK,10,10,,,https://pbs.twimg.com/media/CeHg1klW8AE4YOB.jpg,1,Labrador_retriever,72.05,True,whippet,4.8,True,Chesapeake_Bay_retriever,4.5,True,4144,1172
2016-03-22 01:45:15 +0000,"<a href=""http://twitter.com/download/iphone"" rel=""nofollow"">Twitter for iPhone</a>",This is Steven. He's inverted af. Also very helpful. Scans anything you want for free. Takes him a while tho. 7/10 https://t.co/tA0ZiQ7JcG,7,10,Steven,,https://pbs.twimg.com/media/CeHckpuW4AAF7rT.jpg,1,triceratops,23.54,False,llama,15.31,False,three-toed_sloth,11.18,False,3211,1016
2016-03-22 01:16:55 +0000,"<a href=""http://twitter.com/download/iphone"" rel=""nofollow"">Twitter for iPhone</a>","Say hello to Olive and Ruby. They are best buddies. Both 11/10 
1 like = 1 buddy https://t.co/yagmFdKlyL",11,10,Olive,,https://pbs.twimg.com/media/CeHWFksXIAAyypp.jpg,2,Shih-Tzu,62.51,True,Tibetan_terrier,12.69,True,Lhasa,11.97,True,3531,556
2016-03-21 23:55:01 +0000,"<a href=""http://twitter.com/download/iphone"" rel=""nofollow"">Twitter for iPhone</a>",This is Chester. He's clearly in charge of the other dogs. Weird ass paws. Not fit for fetch. 6/10 would still pet https://t.co/o2GvskrhHt,6,10,Chester,,https://pbs.twimg.com/media/CeHDV73W0AM5Cf8.jpg,1,goose,21.43,False,gibbon,8.43,False,pizza,8.02,False,2451,700
2016-03-21 17:30:03 +0000,"<a href=""http://twitter.com/download/iphone"" rel=""nofollow"">Twitter for iPhone</a>",Meet Winston. He's trapped in a cup of coffee. Poor pupper. 10/10 someone free him https://t.co/2e6cUtKUuc,10,10,Winston,pupper,https://pbs.twimg.com/media/CeFrO3qXEAADRbd.jpg,1,espresso,43.01,False,coffee_mug,41.85,False,cup,8.84,False,8776,2601
2016-03-21 02:38:34 +0000,"<a href=""http://twitter.com/download/iphone"" rel=""nofollow"">Twitter for iPhone</a>",Meet Roosevelt. He's calculating the best case scenario if he drops out instead of doing math hw. 11/10 relatable af https://t.co/QcSIRDpfVg,11,10,Roosevelt,,https://pbs.twimg.com/media/CeCfMPDW0AAAEUj.jpg,1,Lakeland_terrier,45.95,True,miniature_poodle,21.97,True,standard_poodle,13.02,True,3095,1101
2016-03-21 01:54:29 +0000,"<a href=""http://twitter.com/download/iphone"" rel=""nofollow"">Twitter for iPhone</a>",I want to hear the joke this dog was just told. 10/10 https://t.co/1KiuZqqOD4,10,10,,,https://pbs.twimg.com/media/CeCVGEbUYAASeY4.jpg,3,dingo,36.69,False,Ibizan_hound,33.49,True,Eskimo_dog,7.39,True,9756,4653
2016-03-20 23:23:54 +0000,"<a href=""http://twitter.com/download/iphone"" rel=""nofollow"">Twitter for iPhone</a>",Oh. My. God. 13/10 magical af https://t.co/Ezu6jQrKAZ,13,10,,,https://pbs.twimg.com/tweet_video_thumb/CeBym7oXEAEWbEg.jpg,1,brown_bear,71.33,False,Indian_elephant,17.28,False,water_buffalo,3.89,False,35865,20500
2016-03-20 20:36:28 +0000,"<a href=""http://twitter.com/download/iphone"" rel=""nofollow"">Twitter for iPhone</a>",This is Gary. He just wanted to say hi. 9/10 very personable pup https://t.co/Sk3CbhmKSW,9,10,Gary,,https://pbs.twimg.com/media/CeBMT6-WIAA7Qqf.jpg,1,llama,85.68,False,Arabian_camel,9.87,False,neck_brace,1.64,False,4228,1037
2016-03-20 01:28:47 +0000,"<a href=""http://twitter.com/download/iphone"" rel=""nofollow"">Twitter for iPhone</a>","""Please, no puparazzi"" 11/10 https://t.co/nJIXSPfedK",11,10,,,https://pbs.twimg.com/media/Cd9Fn5QUMAAYMT4.jpg,1,Pembroke,75.09,True,Cardigan,24.12,True,basenji,0.26,True,3996,1287
2016-03-19 21:41:44 +0000,"<a href=""http://twitter.com/download/iphone"" rel=""nofollow"">Twitter for iPhone</a>",What hooligan sent in pictures w/out a dog in them? Churlish af. 3/10 just bc that's a neat fluffy bean bag chair https://t.co/wcwoGOkZvz,3,10,,,https://pbs.twimg.com/media/Cd8Rpl0W0AAN1kU.jpg,1,leatherback_turtle,28.08,False,loggerhead,12.33,False,Dandie_Dinmont,8.68,True,3596,819
2016-03-19 01:54:56 +0000,"<a href=""http://twitter.com/download/iphone"" rel=""nofollow"">Twitter for iPhone</a>",This is Chuckles. He had a balloon but he accidentally let go of it and it floated away. 11/10 hang in there pupper https://t.co/68iNM7B5gW,11,10,Chuckles,pupper,https://pbs.twimg.com/media/Cd4CBQFW8AAY3ND.jpg,1,French_bulldog,73.14,True,Boston_bull,15.07,True,pug,2.18,True,3275,710
2016-03-19 01:11:29 +0000,"<a href=""http://twitter.com/download/iphone"" rel=""nofollow"">Twitter for iPhone</a>",Meet Milo and Amos. They are the best of pals. Both 12/10 would pet at the same time https://t.co/Mv37BHEyyD,12,10,Milo,,https://pbs.twimg.com/media/Cd34FClUMAAnvGP.jpg,1,malamute,28.13,True,Eskimo_dog,23.26,True,Pembroke,9.16,True,4960,1561
2016-03-18 15:05:29 +0000,"<a href=""http://twitter.com/download/iphone"" rel=""nofollow"">Twitter for iPhone</a>",This is Staniel. His selfie game is strong af. 10/10 I'd snapchat with Staniel https://t.co/UgkTw7TKyM,10,10,Staniel,,https://pbs.twimg.com/media/Cd1tYGmXIAAoW5b.jpg,1,dingo,53.66,False,Pembroke,20.04,True,basenji,6.07,True,2775,779
2016-03-18 14:19:56 +0000,"<a href=""http://twitter.com/download/iphone"" rel=""nofollow"">Twitter for iPhone</a>",Say hello to Sora. She's an Egyptian Pumpernickel. Mesmerizing af. 12/10 would bring home to mom https://t.co/PmTR4kxZkq,12,10,Sora,,https://pbs.twimg.com/media/Cd1i8qvUkAE-Jlr.jpg,1,Pembroke,80.37,True,Cardigan,18.97,True,German_shepherd,0.17,True,2937,606
2016-03-18 02:46:49 +0000,"<a href=""http://twitter.com/download/iphone"" rel=""nofollow"">Twitter for iPhone</a>",Here's a brigade of puppers. All look very prepared for whatever happens next. 80/80 https://t.co/0eb7R1Om12,80,80,,,https://pbs.twimg.com/media/CdzETn4W4AAVU5N.jpg,1,soft-coated_wheaten_terrier,94.86,True,Dandie_Dinmont,1.87,True,cairn,1.59,True,2529,636
2016-03-17 22:09:38 +0000,"<a href=""http://twitter.com/download/iphone"" rel=""nofollow"">Twitter for iPhone</a>",This is Beemo. He's a Chubberflop mix. 12/10 would cross the world for https://t.co/kzMVMU8HBV,12,10,Beemo,,https://pbs.twimg.com/media/CdyE2x1W8AAe0TG.jpg,4,Pembroke,98.2,True,Cardigan,0.89,True,malamute,0.75,True,4968,2107
2016-03-17 01:55:02 +0000,"<a href=""http://twitter.com/download/iphone"" rel=""nofollow"">Twitter for iPhone</a>",This is Gunner. He's a Figamus Newton. King of the peek-a-boo. Cool jeans. 11/10 https://t.co/ONuBILIYXZ,11,10,Gunner,,https://pbs.twimg.com/media/Cdtu3WRUkAAsRVx.jpg,2,Shih-Tzu,93.24,True,Lhasa,3.08,True,Tibetan_terrier,0.9,True,2308,580
2016-03-17 01:11:26 +0000,"<a href=""http://twitter.com/download/iphone"" rel=""nofollow"">Twitter for iPhone</a>",We ðŸ‘ðŸ» only ðŸ‘ðŸ» rate ðŸ‘ðŸ» dogs. Pls stop sending in non-canines like this Dutch Panda Worm. This is infuriating. 11/10 https://t.co/odfLzBonG2,11,10,,,https://pbs.twimg.com/media/Cdtk414WoAIUG0v.jpg,1,Old_English_sheepdog,58.63,True,wire-haired_fox_terrier,11.86,True,Lakeland_terrier,10.68,True,4945,1425
2016-03-17 00:58:46 +0000,"<a href=""http://twitter.com/download/iphone"" rel=""nofollow"">Twitter for iPhone</a>","The squad is back for St. Patrick's Day! â˜˜ ðŸ’š
13/10 for all https://t.co/OcCDb2bng5",13,10,,,https://pbs.twimg.com/media/Cdth_KyWEAEXH3u.jpg,1,pug,41.55,True,German_shepherd,17.82,True,Labrador_retriever,10.02,True,2613,1257
2016-03-16 17:18:07 +0000,"<a href=""http://twitter.com/download/iphone"" rel=""nofollow"">Twitter for iPhone</a>",This is Lacy. She's tipping her hat to you. Daydreams of her life back on the frontier. 11/10 would pet so well https://t.co/fG5Pk3Et1I,11,10,Lacy,,https://pbs.twimg.com/media/Cdr4jO2UAAAIo6W.jpg,2,cowboy_hat,97.91,False,sombrero,1.07,False,cocker_spaniel,0.27,True,3153,1006
2016-03-16 16:29:35 +0000,"<a href=""http://twitter.com/download/iphone"" rel=""nofollow"">Twitter for iPhone</a>",This is Tater. His underbite is fierce af. Doesn't give a damn about your engagement photo. 8/10 https://t.co/nLuPY3pY12,8,10,Tater,,https://pbs.twimg.com/media/Cdrtcr-W4AAqi5H.jpg,1,Pekinese,95.32,True,papillon,1.95,True,Japanese_spaniel,0.58,True,3017,1008
2016-03-16 14:54:24 +0000,"<a href=""http://twitter.com/download/iphone"" rel=""nofollow"">Twitter for iPhone</a>",This pupper got her hair chalked for her birthday. Hasn't told her parents yet. Rebellious af. 11/10 very nifty https://t.co/h1OX2mLtxV,11,10,,pupper,https://pbs.twimg.com/media/CdrXp9dWoAAcRfn.jpg,2,toy_poodle,80.21,True,miniature_poodle,11.16,True,cocker_spaniel,6.29,True,5999,2233
2016-03-16 01:46:45 +0000,"<a href=""http://twitter.com/download/iphone"" rel=""nofollow"">Twitter for iPhone</a>",Meet Watson. He's a Suzuki Tickleboop. Leader of a notorious biker gang. Only one ear functional. 12/10 snuggable af https://t.co/R1gLc5vDqG,12,10,Watson,,https://pbs.twimg.com/media/CdojYQmW8AApv4h.jpg,2,Pembroke,95.62,True,Cardigan,2.07,True,Chihuahua,0.79,True,3250,1215
2016-03-16 00:37:03 +0000,"<a href=""http://twitter.com/download/iphone"" rel=""nofollow"">Twitter for iPhone</a>","WeRateDogs stickers are here and they're 12/10! Use code ""puppers"" at checkout ðŸ¶ðŸ¾

Shop now: https://t.co/k5xsufRKYm https://t.co/ShXk46V13r",12,10,,,https://pbs.twimg.com/media/CdoTbL_XIAAitq2.jpg,2,bib,99.88,False,handkerchief,0.05,False,umbrella,0.02,False,732,112
2016-03-15 21:24:41 +0000,"<a href=""http://twitter.com/download/iphone"" rel=""nofollow"">Twitter for iPhone</a>",*lets out a tiny whimper and then collapses* ...12/10 https://t.co/BNdVZEHRow,12,10,,,https://pbs.twimg.com/media/CdnnZhhWAAEAoUc.jpg,2,Chihuahua,94.56,True,Pomeranian,1.92,True,West_Highland_white_terrier,1.01,True,3824,1336
2016-03-15 02:25:31 +0000,"<a href=""http://twitter.com/download/iphone"" rel=""nofollow"">Twitter for iPhone</a>",This is Olaf. He's gotta be rare. Seems sturdy. Tail is floofy af. 12/10 would do whatever it takes to pet https://t.co/E9jaU59bh9,12,10,Olaf,,https://pbs.twimg.com/media/Cdjiqi6XIAIUOg-.jpg,1,chow,99.98,True,Tibetan_mastiff,0.01,True,Australian_terrier,0.0,True,3865,1367
2016-03-15 01:48:55 +0000,"<a href=""http://twitter.com/download/iphone"" rel=""nofollow"">Twitter for iPhone</a>",This is Cecil. She's a Gigglefloof Poofer. Outdoorsy af. One with nature. 12/10 would strategically capture https://t.co/ijJB0DuOIC,12,10,Cecil,,https://pbs.twimg.com/media/CdjaSFCWAAAJZh3.jpg,2,golden_retriever,79.0,True,kuvasz,10.5,True,Labrador_retriever,8.71,True,3593,1204
2016-03-14 23:19:03 +0000,"<a href=""http://twitter.com/download/iphone"" rel=""nofollow"">Twitter for iPhone</a>",This is Vince. He's a Gregorian Flapjeck. White spot on legs almost looks like another dog (whoa). 9/10 rad as hell https://t.co/aczGAV2dK4,9,10,Vince,,https://pbs.twimg.com/media/Cdi3-f7W8AUOm9T.jpg,1,cocker_spaniel,41.5,True,Newfoundland,22.55,True,flat-coated_retriever,19.68,True,1620,277
2016-03-14 18:42:20 +0000,"<a href=""http://twitter.com/download/iphone"" rel=""nofollow"">Twitter for iPhone</a>",Meet Karma. She's just a head. Lost body during the Second Punic War (unfortunate). Loves to travel 10/10 petable af https://t.co/c6af6nYEPo,10,10,Karma,,https://pbs.twimg.com/media/Cdh4pgAW0AEKJ_a.jpg,2,Maltese_dog,78.02,True,Dandie_Dinmont,7.44,True,Norfolk_terrier,3.38,True,2420,665
2016-03-14 16:02:49 +0000,"<a href=""http://twitter.com/download/iphone"" rel=""nofollow"">Twitter for iPhone</a>",This is Billy. He sensed a squirrel. 8/10 damn it Billy https://t.co/Yu0K98VZ9A,8,10,Billy,,https://pbs.twimg.com/media/CdhUIMSUIAA4wYK.jpg,1,Shetland_sheepdog,79.74,True,collie,5.41,True,keeshond,3.17,True,2855,788
2016-03-14 03:50:21 +0000,"<a href=""http://twitter.com/download/iphone"" rel=""nofollow"">Twitter for iPhone</a>",This is Walker. He's a Butternut Khalifa. Appears fuzzy af. 11/10 would hug for a ridiculous amount of time https://t.co/k6fEWHSALn,11,10,Walker,,https://pbs.twimg.com/media/Cdese-zWEAArIqE.jpg,1,Labrador_retriever,27.11,True,Pomeranian,15.05,True,golden_retriever,14.56,True,2615,647
2016-03-14 02:39:42 +0000,"<a href=""http://twitter.com/download/iphone"" rel=""nofollow"">Twitter for iPhone</a>",This is Penny. She's trying on her prom dress. Stunning af 11/10 https://t.co/qcZDZGCapg,11,10,Penny,,https://pbs.twimg.com/media/CdecUSzUIAAHCvg.jpg,1,Chihuahua,94.83,True,Italian_greyhound,1.77,True,quilt,1.67,False,13755,6567
2016-03-14 02:04:08 +0000,"<a href=""http://twitter.com/download/iphone"" rel=""nofollow"">Twitter for iPhone</a>","From left to right:
Cletus, Jerome, Alejandro, Burp, &amp; Titson
None know where camera is. 45/50 would hug all at once https://t.co/sedre1ivTK",45,50,,,https://pbs.twimg.com/media/CdeUKpcWoAAJAWJ.jpg,1,borzoi,49.08,True,wire-haired_fox_terrier,8.35,True,English_setter,8.32,True,2634,721
