timestamp,source,text,rating_numerator,rating_denominator,name,dog_stage,jpg_url,img_num,p1,p1_conf,p1_dog,p2,p2_conf,p2_dog,p3,p3_conf,p3_dog,favorites,retweets
2017-08-01 16:23:56 +0000,"<a href=""http://twitter.com/download/iphone"" rel=""nofollow"">Twitter for iPhone</a>",This is Phineas. He's a mystical boy. Only ever appears in the hole of a donut. 13/10 https://t.co/MgUWQ76dJU,13,10,Phineas,,https://pbs.twimg.com/media/DGKD1-bXoAAIAUK.jpg,1,orange,9.7,False,bagel,8.59,False,banana,7.61,False,39467,8853
2017-08-01 00:17:27 +0000,"<a href=""http://twitter.com/download/iphone"" rel=""nofollow"">Twitter for iPhone</a>","This is Tilly. She's just checking pup on you. Hopes you're doing ok. If not, she's available for pats, snugs, boops, the whole bit. 13/10 https://t.co/0Xxu71qeIV",13,10,Tilly,,https://pbs.twimg.com/media/DGGmoV4XsAAUL6n.jpg,1,Chihuahua,32.36,True,Pekinese,9.06,True,papillon,6.9,True,33819,6514
2017-07-31 00:18:03 +0000,"<a href=""http://twitter.com/download/iphone"" rel=""nofollow"">Twitter for iPhone</a>",This is Archie. He is a rare Norwegian Pouncing Corgo. Lives in the tall grass. You never know when one may strike. 12/10 https://t.co/wUnZnhtVJB,12,10,Archie,,https://pbs.twimg.com/media/DGBdLU1WsAANxJ9.jpg,1,Chihuahua,71.6,True,malamute,7.83,True,kelpie,3.14,True,25461,4328
2017-07-30 15:58:51 +0000,"<a href=""http://twitter.com/download/iphone"" rel=""nofollow"">Twitter for iPhone</a>",This is Darla. She commenced a snooze mid meal. 13/10 happens to the best of us https://t.co/tD36da7qLQ,13,10,Darla,,https://pbs.twimg.com/media/DF_q7IAWsAEuuN8.jpg,1,paper_towel,17.03,False,Labrador_retriever,16.81,True,spatula,4.08,False,42908,8964
2017-07-29 16:00:24 +0000,"<a href=""http://twitter.com/download/iphone"" rel=""nofollow"">Twitter for iPhone</a>","This is Franklin. He would like you to stop calling him ""cute."" He is a very fierce shark and should be respected as such. 12/10 #BarkWeek https://t.co/AtUZn91f7f",12,10,Franklin,,https://pbs.twimg.com/media/DF6hr6BUMAAzZgT.jpg,2,basset,55.57,True,English_springer,22.58,True,German_short-haired_pointer,17.52,True,41048,9774
2017-07-29 00:08:17 +0000,"<a href=""http://twitter.com/download/iphone"" rel=""nofollow"">Twitter for iPhone</a>",Here we have a majestic great white breaching off South Africa's coast. Absolutely h*ckin breathtaking. 13/10 (IG: tucker_marlo) #BarkWeek https://t.co/kQ04fDDRmh,13,10,,,https://pbs.twimg.com/media/DF3HwyEWsAABqE6.jpg,1,Chesapeake_Bay_retriever,42.56,True,Irish_terrier,11.63,True,Indian_elephant,7.69,False,20562,3261
2017-07-28 16:27:12 +0000,"<a href=""http://twitter.com/download/iphone"" rel=""nofollow"">Twitter for iPhone</a>","Meet Jax. He enjoys ice cream so much he gets nervous around it. 13/10 help Jax enjoy more things by clicking below

https://t.co/Zr4hWfAs1H https://t.co/tVJBRMnhxl",13,10,Jax,,https://pbs.twimg.com/media/DF1eOmZXUAALUcq.jpg,1,Appenzeller,34.17,True,Border_collie,19.93,True,ice_lolly,19.35,False,12041,2158
2017-07-28 00:22:40 +0000,"<a href=""http://twitter.com/download/iphone"" rel=""nofollow"">Twitter for iPhone</a>",When you watch your owner call another dog a good boy but then they turn back to you and say you're a great boy. 13/10 https://t.co/v0nONBcwxq,13,10,,,https://pbs.twimg.com/media/DFyBahAVwAAhUTd.jpg,2,Pomeranian,56.61,True,Eskimo_dog,17.84,True,Pembroke,7.65,True,56848,16716
2017-07-27 16:25:51 +0000,"<a href=""http://twitter.com/download/iphone"" rel=""nofollow"">Twitter for iPhone</a>",This is Zoey. She doesn't want to be one of the scary sharks. Just wants to be a snuggly pettable boatpet. 13/10 #BarkWeek https://t.co/9TwLuAGH0b,13,10,Zoey,,https://pbs.twimg.com/media/DFwUU__XcAEpyXI.jpg,1,Irish_terrier,48.76,True,Irish_setter,19.31,True,Chesapeake_Bay_retriever,11.82,True,28226,4429
2017-07-26 15:59:51 +0000,"<a href=""http://twitter.com/download/iphone"" rel=""nofollow"">Twitter for iPhone</a>",This is Cassie. She is a college pup. Studying international doggo communication and stick theory. 14/10 so elegant much sophisticate https://t.co/t1bfwz5S2A,14,10,Cassie,doggo,https://pbs.twimg.com/media/DFrEyVuW0AAO3t9.jpg,1,Pembroke,51.13,True,Cardigan,45.1,True,Chihuahua,2.92,True,32467,7711
2017-07-26 00:31:25 +0000,"<a href=""http://twitter.com/download/iphone"" rel=""nofollow"">Twitter for iPhone</a>",This is Koda. He is a South Australian deckshark. Deceptively deadly. Frighteningly majestic. 13/10 would risk a petting #BarkWeek https://t.co/dVPW0B0Mme,13,10,Koda,,https://pbs.twimg.com/media/DFnwSY4WAAAMliS.jpg,1,Samoyed,95.8,True,Pomeranian,1.39,True,chow,0.82,True,31166,7624
2017-07-25 16:11:53 +0000,"<a href=""http://twitter.com/download/iphone"" rel=""nofollow"">Twitter for iPhone</a>",This is Bruno. He is a service shark. Only gets out of the water to assist you. 13/10 terrifyingly good boy https://t.co/u1XPQMl29g,13,10,Bruno,,https://pbs.twimg.com/media/DFl99B1WsAITKsg.jpg,1,French_bulldog,37.74,True,Labrador_retriever,15.13,True,muzzle,8.3,False,28268,5156
2017-07-25 01:55:32 +0000,"<a href=""http://twitter.com/download/iphone"" rel=""nofollow"">Twitter for iPhone</a>",Here's a puppo that seems to be on the fence about something haha no but seriously someone help her. 13/10 https://t.co/BxvuXk0UCm,13,10,,puppo,https://pbs.twimg.com/media/DFi579UWsAAatzw.jpg,1,Pembroke,96.63,True,Cardigan,2.74,True,basenji,0.46,True,38818,8538
2017-07-25 00:10:02 +0000,"<a href=""http://twitter.com/download/iphone"" rel=""nofollow"">Twitter for iPhone</a>",This is Ted. He does his best. Sometimes that's not enough. But it's ok. 12/10 would assist https://t.co/f8dEDcrKSR,12,10,Ted,,https://pbs.twimg.com/media/DFihzFfXsAYGDPR.jpg,1,French_bulldog,99.16,True,boxer,0.21,True,Staffordshire_bullterrier,0.15,True,27672,4735
2017-07-24 17:02:04 +0000,"<a href=""http://twitter.com/download/iphone"" rel=""nofollow"">Twitter for iPhone</a>",This is Stuart. He's sporting his favorite fanny pack. Secretly filled with bones only. 13/10 puppared puppo #BarkWeek https://t.co/y70o6h3isq,13,10,Stuart,puppo,https://pbs.twimg.com/media/DFg_2PVW0AEHN3p.jpg,1,golden_retriever,95.34,True,Labrador_retriever,1.38,True,redbone,0.8,True,15359,2321
2017-07-24 00:19:32 +0000,"<a href=""http://twitter.com/download/iphone"" rel=""nofollow"">Twitter for iPhone</a>",This is Oliver. You're witnessing one of his many brutal attacks. Seems to be playing with his victim. 13/10 fr*ckin frightening #BarkWeek https://t.co/WpHvrQedPb,13,10,Oliver,,https://pbs.twimg.com/ext_tw_video_thumb/889278779352338437/pu/img/VlbFB3v8H8VwzVNY.jpg,1,whippet,62.62,True,borzoi,19.47,True,Saluki,2.74,True,25652,5637
2017-07-23 00:22:39 +0000,"<a href=""http://twitter.com/download/iphone"" rel=""nofollow"">Twitter for iPhone</a>",This is Jim. He found a fren. Taught him how to sit like the good boys. 12/10 for both https://t.co/chxruIOUJN,12,10,Jim,,https://pbs.twimg.com/media/DFYRgsOUQAARGhO.jpg,1,golden_retriever,71.47,True,Tibetan_mastiff,12.02,True,Labrador_retriever,10.55,True,29611,4709
2017-07-22 16:56:37 +0000,"<a href=""http://twitter.com/download/iphone"" rel=""nofollow"">Twitter for iPhone</a>",This is Zeke. He has a new stick. Very proud of it. Would like you to throw it for him without taking it. 13/10 would do my best https://t.co/HTQ77yNQ5K,13,10,Zeke,,https://pbs.twimg.com/media/DFWra-3VYAA2piG.jpg,1,golden_retriever,46.98,True,Labrador_retriever,18.42,True,English_setter,7.35,True,26080,4559
2017-07-22 00:23:06 +0000,"<a href=""http://twitter.com/download/iphone"" rel=""nofollow"">Twitter for iPhone</a>",This is Ralphus. He's powering up. Attempting maximum borkdrive. 13/10 inspirational af https://t.co/YnYAFCTTiK,13,10,Ralphus,,https://pbs.twimg.com/media/DFTH_O-UQAACu20.jpg,3,Siberian_husky,70.04,True,Eskimo_dog,16.65,True,malamute,11.14,True,20290,3732
2017-07-20 16:49:33 +0000,"<a href=""http://twitter.com/download/iphone"" rel=""nofollow"">Twitter for iPhone</a>",This is Gerald. He was just told he didn't get the job he interviewed for. A h*ckin injustice. 12/10 didn't want the job anyway https://t.co/DK7iDPfuRX,12,10,Gerald,,https://pbs.twimg.com/media/DFMWn56WsAAkA7B.jpg,1,French_bulldog,99.5,True,pug,0.09,True,bull_mastiff,0.09,True,22201,3653
2017-07-19 16:06:48 +0000,"<a href=""http://twitter.com/download/iphone"" rel=""nofollow"">Twitter for iPhone</a>",This is Jeffrey. He has a monopoly on the pool noodles. Currently running a 'boop for two' midweek sale. 13/10 h*ckin strategic https://t.co/PhrUk20Q64,13,10,Jeffrey,,https://pbs.twimg.com/media/DFHDQBbXgAEqY7t.jpg,1,basset,82.17,True,redbone,8.76,True,Weimaraner,2.62,True,30779,5609
2017-07-19 03:39:09 +0000,"<a href=""http://twitter.com/download/iphone"" rel=""nofollow"">Twitter for iPhone</a>",I've yet to rate a Venezuelan Hover Wiener. This is such an honor. 14/10 paw-inspiring af (IG: roxy.thedoxy) https://t.co/20VrLAA8ba,14,10,,,https://pbs.twimg.com/ext_tw_video_thumb/887517108413886465/pu/img/WanJKwssZj4VJvL9.jpg,1,limousine,13.04,False,tow_truck,2.92,False,shopping_cart,2.63,False,46959,12082
2017-07-19 00:47:34 +0000,"<a href=""http://twitter.com/download/iphone"" rel=""nofollow"">Twitter for iPhone</a>",This is Canela. She attempted some fancy porch pics. They were unsuccessful. 13/10 someone help her https://t.co/cLyzpcUcMX,13,10,Canela,,https://pbs.twimg.com/media/DFDw2tyUQAAAFke.jpg,2,Pembroke,80.92,True,Rhodesian_ridgeback,5.5,True,beagle,3.89,True,69871,18781
2017-07-18 16:08:03 +0000,"<a href=""http://twitter.com/download/iphone"" rel=""nofollow"">Twitter for iPhone</a>",You may not have known you needed to see this today. 13/10 please enjoy (IG: emmylouroo) https://t.co/WZqNqygEyV,13,10,,,https://pbs.twimg.com/ext_tw_video_thumb/887343120832229379/pu/img/6HSuFrW1lzI_9Mht.jpg,1,Mexican_hairless,33.07,True,sea_lion,27.56,False,Weimaraner,13.42,True,34222,10737
2017-07-18 00:07:08 +0000,"<a href=""http://twitter.com/download/iphone"" rel=""nofollow"">Twitter for iPhone</a>",This... is a Jubilant Antarctic House Bear. We only rate dogs. Please only send dogs. Thank you... 12/10 would suffocate in floof https://t.co/4Ad1jzJSdp,12,10,,,https://pbs.twimg.com/media/DE-eAq6UwAA-jaE.jpg,1,Samoyed,73.39,True,Eskimo_dog,3.5,True,Staffordshire_bullterrier,2.97,True,31061,6167
2017-07-17 16:17:36 +0000,"<a href=""http://twitter.com/download/iphone"" rel=""nofollow"">Twitter for iPhone</a>",This is Maya. She's very shy. Rarely leaves her cup. 13/10 would find her an environment to thrive in https://t.co/I6oNy0CgiT,13,10,Maya,,https://pbs.twimg.com/media/DE8yicJW0AAAvBJ.jpg,2,Chihuahua,79.35,True,toy_terrier,14.35,True,can_opener,3.23,False,35859,8084
2017-07-16 23:58:41 +0000,"<a href=""http://twitter.com/download/iphone"" rel=""nofollow"">Twitter for iPhone</a>","This is Mingus. He's a wonderful father to his smol pup. Confirmed 13/10, but he needs your help

https://t.co/bVi0Yr4Cff https://t.co/ISvKOSkd5b",13,10,Mingus,,https://pbs.twimg.com/media/DE5Se8FXcAAJFx4.jpg,1,kuvasz,30.97,True,Great_Pyrenees,18.61,True,Dandie_Dinmont,8.63,True,12306,3443
2017-07-16 20:14:00 +0000,"<a href=""http://twitter.com/download/iphone"" rel=""nofollow"">Twitter for iPhone</a>",This is Derek. He's late for a dog meeting. 13/10 pet...al to the metal https://t.co/BCoWue0abA,13,10,Derek,,https://pbs.twimg.com/media/DE4fEDzWAAAyHMM.jpg,1,convertible,73.9,False,sports_car,14.0,False,car_wheel,4.42,False,22798,4610
2017-07-15 23:25:31 +0000,"<a href=""http://twitter.com/download/iphone"" rel=""nofollow"">Twitter for iPhone</a>",This is Roscoe. Another pupper fallen victim to spontaneous tongue ejections. Get the BlepiPen immediate. 12/10 deep breaths Roscoe https://t.co/RGE08MIJox,12,10,Roscoe,pupper,https://pbs.twimg.com/media/DE0BTnQUwAApKEH.jpg,1,French_bulldog,99.92,True,Chihuahua,0.04,True,Boston_bull,0.01,True,21524,3316
2017-07-15 16:17:19 +0000,"<a href=""http://twitter.com/download/iphone"" rel=""nofollow"">Twitter for iPhone</a>",This is Waffles. His doggles are pupside down. Unsure how to fix. 13/10 someone assist Waffles https://t.co/xZDA9Qsq1O,13,10,Waffles,,https://pbs.twimg.com/media/DEyfTG4UMAE4aE9.jpg,1,pug,94.36,True,shower_cap,2.53,False,Siamese_cat,0.28,False,28469,6523
2017-07-14 22:10:11 +0000,"<a href=""http://twitter.com/download/iphone"" rel=""nofollow"">Twitter for iPhone</a>",Viewer discretion advised. This is Jimbo. He will rip ur finger right h*ckin off. Other dog clearly an accessory. 12/10 pls pet with caution https://t.co/BuveP0uMF1,12,10,Jimbo,,https://pbs.twimg.com/media/DEumeWWV0AA-Z61.jpg,1,Blenheim_spaniel,97.25,True,Shih-Tzu,0.66,True,Bernese_mountain_dog,0.62,True,33382,7097
2017-07-13 15:58:47 +0000,"<a href=""http://twitter.com/download/iphone"" rel=""nofollow"">Twitter for iPhone</a>",This is Maisey. She fell asleep mid-excavation. Happens to the best of us. 13/10 would pat noggin approvingly https://t.co/tp1kQ8i9JF,13,10,Maisey,,https://pbs.twimg.com/media/DEoH3yvXgAAzQtS.jpg,1,pug,36.93,True,Labrador_retriever,26.58,True,kuvasz,13.47,True,36689,6683
2017-07-12 16:03:00 +0000,"<a href=""http://twitter.com/download/iphone"" rel=""nofollow"">Twitter for iPhone</a>",Here we have a corgi undercover as a malamute. Pawbably doing important investigative work. Zero control over tongue happenings. 13/10 https://t.co/44ItaMubBf,13,10,,,https://pbs.twimg.com/media/DEi_N9qXYAAgEEw.jpg,4,malamute,81.25,True,Siberian_husky,7.17,True,Eskimo_dog,5.58,True,22367,4556
2017-07-12 00:01:00 +0000,"<a href=""http://twitter.com/download/iphone"" rel=""nofollow"">Twitter for iPhone</a>","This is Earl. He found a hat. Nervous about what you think of it. 12/10 it's delightful, Earl https://t.co/MYJvdlNRVa",12,10,Earl,,https://pbs.twimg.com/media/DEfjEaNXkAAtPlj.jpg,1,Italian_greyhound,25.99,True,American_Staffordshire_terrier,19.85,True,Staffordshire_bullterrier,12.77,True,68152,16439
2017-07-11 20:47:12 +0000,"<a href=""http://twitter.com/download/iphone"" rel=""nofollow"">Twitter for iPhone</a>",This is Lola. It's her first time outside. Must test the earth and taste the atmosphere. 13/10 you're doing great Lola https://t.co/74TKAUsLkO,13,10,Lola,,https://pbs.twimg.com/media/DEe2tZXXkAAwyX3.jpg,1,chow,82.21,True,Norwich_terrier,10.61,True,Norfolk_terrier,3.73,True,28514,6096
2017-07-11 00:00:02 +0000,"<a href=""http://twitter.com/download/iphone"" rel=""nofollow"">Twitter for iPhone</a>",This is Kevin. He's just so happy. 13/10 what is your secret Kevin https://t.co/1r4MFCbCX5,13,10,Kevin,,https://pbs.twimg.com/media/DEaZQkfXUAEC7qB.jpg,1,pug,54.64,True,French_bulldog,40.43,True,Brabancon_griffon,4.4,True,24765,5100
2017-07-10 15:58:53 +0000,"<a href=""http://twitter.com/download/iphone"" rel=""nofollow"">Twitter for iPhone</a>","I present to you, Pup in Hat. Pup in Hat is great for all occasions. Extremely versatile. Compact as h*ck. 14/10 (IG: itselizabethgales) https://t.co/vvBOcC2VdC",14,10,,,https://pbs.twimg.com/media/DEYrIZwWsAA2Wo5.jpg,1,Pembroke,99.32,True,Cardigan,0.32,True,Chihuahua,0.21,True,27478,5856
2017-07-09 21:29:42 +0000,"<a href=""http://twitter.com/download/iphone"" rel=""nofollow"">Twitter for iPhone</a>",Meet Yogi. He doesn't have any important dog meetings today he just enjoys looking his best at all times. 12/10 for dangerously dapper doggo https://t.co/YSI00BzTBZ,12,10,Yogi,doggo,https://pbs.twimg.com/media/DEUtQbzW0AUTv_o.jpg,1,German_shepherd,70.7,True,malinois,19.94,True,Norwegian_elkhound,4.91,True,20771,3128
2017-07-09 00:00:04 +0000,"<a href=""http://twitter.com/download/iphone"" rel=""nofollow"">Twitter for iPhone</a>",This is Noah. He can't believe someone made this mess. Got the vacuum out for you though. Offered to help clean pup. 12/10 super good boy https://t.co/V85xujjDDY,12,10,Noah,,https://pbs.twimg.com/media/DEQGFgAXUAAEvfi.jpg,1,Doberman,61.09,True,miniature_pinscher,29.96,True,kelpie,6.3,True,22349,3586
2017-07-08 00:28:19 +0000,"<a href=""http://twitter.com/download/iphone"" rel=""nofollow"">Twitter for iPhone</a>","This is Bella. She hopes her smile made you smile. If not, she is also offering you her favorite monkey. 13.5/10 https://t.co/qjrljjt948",5,10,Bella,,https://pbs.twimg.com/media/DELC9dZXUAADqUk.jpg,1,golden_retriever,94.31,True,Labrador_retriever,3.24,True,kuvasz,0.55,True,46860,10407
2017-07-07 16:22:55 +0000,"<a href=""http://twitter.com/download/iphone"" rel=""nofollow"">Twitter for iPhone</a>",Meet Grizzwald. He may be the floofiest floofer I ever did see. Lost eyes saving a schoolbus from a volcano erpuption. 13/10 heroic as h*ck https://t.co/rf661IFEYP,13,10,Grizzwald,floofer,https://pbs.twimg.com/media/DEJT3FeXoAAtwUy.jpg,1,chow,98.8,True,Tibetan_mastiff,0.71,True,Newfoundland,0.21,True,22986,3825
2017-07-07 00:17:54 +0000,"<a href=""http://twitter.com/download/iphone"" rel=""nofollow"">Twitter for iPhone</a>","Please only send dogs. We don't rate mechanics, no matter how h*ckin good. Thank you... 13/10 would sneak a pat https://t.co/Se5fZ9wp5E",13,10,,,https://pbs.twimg.com/media/DEF2-_hXoAAs62q.jpg,2,golden_retriever,94.96,True,Labrador_retriever,4.59,True,kuvasz,0.25,True,37914,6949
2017-07-06 15:58:11 +0000,"<a href=""http://twitter.com/download/iphone"" rel=""nofollow"">Twitter for iPhone</a>",This is Rusty. He wasn't ready for the first pic. Clearly puppared for the second. 13/10 confirmed great boy https://t.co/tyER0KpdXj,13,10,Rusty,,https://pbs.twimg.com/media/DEEEnIqXYAAiJh_.jpg,1,Eskimo_dog,46.68,True,Siberian_husky,40.6,True,dingo,7.34,False,24445,4122
2017-07-06 00:46:41 +0000,"<a href=""http://twitter.com/download/iphone"" rel=""nofollow"">Twitter for iPhone</a>",This is Gus. He's quite the cheeky pupper. Already perfected the disinterested wink. 12/10 would let steal my girl https://t.co/D43I96SlVu,12,10,Gus,pupper,https://pbs.twimg.com/media/DEAz_HHXsAA-p_z.jpg,1,Labrador_retriever,85.0,True,Chesapeake_Bay_retriever,7.43,True,flat-coated_retriever,1.56,True,28903,5134
2017-07-05 15:48:34 +0000,"<a href=""http://twitter.com/download/iphone"" rel=""nofollow"">Twitter for iPhone</a>",This is Stanley. He has his first swim lesson today. Doggle straps adjusted. Ready to go. 13/10 Phelps is nervous (IG: stanleythe_corgi) https://t.co/Nx52PGwH94,13,10,Stanley,,https://pbs.twimg.com/media/DD-40X3WAAAJPU5.jpg,1,Pembroke,54.3,True,Chihuahua,25.2,True,Cardigan,10.77,True,28382,6342
2017-07-04 16:01:23 +0000,"<a href=""http://twitter.com/download/iphone"" rel=""nofollow"">Twitter for iPhone</a>",This is Alfy. You're witnessing his first watermelon experience. I think it was a success. 13/10 happy 4th Alfy ðŸ‡ºðŸ‡¸ https://t.co/fYP5RlutfA,13,10,Alfy,,https://pbs.twimg.com/media/DD5yKdPW0AArzX8.jpg,1,golden_retriever,76.22,True,Labrador_retriever,9.9,True,cocker_spaniel,1.72,True,45880,12118
2017-07-04 01:18:17 +0000,"<a href=""http://twitter.com/download/iphone"" rel=""nofollow"">Twitter for iPhone</a>","This is Koko. Her owner, inspired by Barney, recently built a cart for her to use during walks if she got tired. 13/10 rest easy Koko https://t.co/zeDpnsKX7w",13,10,Koko,,https://pbs.twimg.com/media/DD2oCl2WAAEI_4a.jpg,1,web_site,94.96,False,dhole,1.73,False,golden_retriever,0.69,True,29900,5203
2017-07-03 16:04:48 +0000,"<a href=""http://twitter.com/download/iphone"" rel=""nofollow"">Twitter for iPhone</a>",This is Rey. He's a Benebop Cumberfloof. 12/10 dangerously pettable https://t.co/503CgWbhxQ,12,10,Rey,,https://pbs.twimg.com/media/DD0pWm9XcAAeSBL.jpg,1,Weimaraner,29.15,True,Chesapeake_Bay_retriever,27.9,True,koala,12.7,False,24773,3533
2017-07-03 00:11:11 +0000,"<a href=""http://twitter.com/download/iphone"" rel=""nofollow"">Twitter for iPhone</a>",This is Gary. He couldn't miss this puppertunity for a selfie. Flawless focusing skills. 13/10 would boop intensely https://t.co/7CSWCl8I6s,13,10,Gary,,https://pbs.twimg.com/media/DDxPFwbWAAEbVVR.jpg,1,Saluki,52.9,True,Afghan_hound,25.0,True,golden_retriever,16.07,True,51522,11099
2017-07-02 15:32:16 +0000,"<a href=""http://twitter.com/download/iphone"" rel=""nofollow"">Twitter for iPhone</a>","Here is a pupper approaching maximum borkdrive. Zooming at never before seen speeds. 14/10 paw-inspiring af 
(IG: puffie_the_chow) https://t.co/ghXBIIeQZF",14,10,,pupper,https://pbs.twimg.com/ext_tw_video_thumb/881535971568889856/pu/img/9bawiZ--8FKywTkz.jpg,1,Samoyed,28.15,True,Angora,27.21,False,Persian_cat,11.49,False,50199,16570
2017-07-01 21:49:04 +0000,"<a href=""http://twitter.com/download/iphone"" rel=""nofollow"">Twitter for iPhone</a>",Meet Elliot. He's a Canadian Forrest Pup. Unusual number of antlers for a dog. Sneaky tongue slip to celebrate #Canada150. 12/10 would pet https://t.co/cgwJwowTMC,12,10,Elliot,,https://pbs.twimg.com/media/DDrk-f9WAAI-WQv.jpg,1,tusker,47.33,False,Indian_elephant,24.56,False,ibex,5.57,False,23501,5358
2017-06-30 23:47:07 +0000,"<a href=""http://twitter.com/download/iphone"" rel=""nofollow"">Twitter for iPhone</a>",This is Louis. He's crossing. It's a big deal. 13/10 h*ckin breathtaking https://t.co/D0wb1GlKAt,13,10,Louis,,https://pbs.twimg.com/media/DDm2Z5aXUAEDS2u.jpg,1,street_sign,25.18,False,umbrella,11.51,False,traffic_light,6.95,False,17346,2886
2017-06-30 19:35:32 +0000,"<a href=""http://twitter.com/download/iphone"" rel=""nofollow"">Twitter for iPhone</a>",Ugh not again. We only rate dogs. Please don't send in well-dressed  floppy-tongued street penguins. Dogs only please. Thank you... 12/10 https://t.co/WiAMbTkDPf,12,10,,,https://pbs.twimg.com/media/DDl8zzJW0AAisCJ.jpg,1,Pembroke,79.14,True,Norwich_terrier,6.14,True,Chihuahua,3.37,True,21734,3989
2017-06-29 16:39:47 +0000,"<a href=""http://twitter.com/download/iphone"" rel=""nofollow"">Twitter for iPhone</a>",This is Bella. She had her first beach experience this morning. Complete success. 12/10 would perform a sandy boop https://t.co/4VsFysDmiw,12,10,Bella,,https://pbs.twimg.com/media/DDgK-J4XUAIEV9W.jpg,1,golden_retriever,91.33,True,Labrador_retriever,2.63,True,cocker_spaniel,0.94,True,29075,6546
2017-06-29 00:27:25 +0000,"<a href=""http://twitter.com/download/iphone"" rel=""nofollow"">Twitter for iPhone</a>",Meet Jesse. He's a Fetty Woof. His tongue ejects without warning. A true bleptomaniac. 12/10 would snug well https://t.co/fUod0tVmvK,12,10,Jesse,,https://pbs.twimg.com/media/DDcscbXU0AIfDzs.jpg,1,Chihuahua,23.85,True,meerkat,10.43,False,clumber,5.26,True,27640,4436
2017-06-28 16:09:20 +0000,"<a href=""http://twitter.com/download/iphone"" rel=""nofollow"">Twitter for iPhone</a>",Please don't send in photos without dogs in them. We're not @porch_rates. Insubordinate and churlish. Pretty good porch tho 11/10 https://t.co/HauE8M3Bu4,11,10,,,https://pbs.twimg.com/media/DDa6ckbXgAAM1vV.jpg,1,miniature_pinscher,12.03,True,Rhodesian_ridgeback,10.64,True,beagle,10.61,True,28150,4533
2017-06-28 00:42:13 +0000,"<a href=""http://twitter.com/download/iphone"" rel=""nofollow"">Twitter for iPhone</a>",This is Romeo. He would like to do an entrance. Requesting your immediate assistance. 13/10 https://t.co/Qh5aEkRQm9,13,10,Romeo,,https://pbs.twimg.com/media/DDXmPrbWAAEKMvy.jpg,3,basset,81.35,True,beagle,14.67,True,cocker_spaniel,0.95,True,22667,3642
2017-06-27 00:10:17 +0000,"<a href=""http://twitter.com/download/iphone"" rel=""nofollow"">Twitter for iPhone</a>",This is Bailey. He thinks you should measure ear length for signs of growth instead. 12/10 https://t.co/IxM9IMKQq8,12,10,Bailey,,https://pbs.twimg.com/media/DDSVWMvXsAEgmMK.jpg,1,German_short-haired_pointer,47.99,True,vizsla,12.44,True,bath_towel,7.33,False,23822,3323
2017-06-26 19:07:24 +0000,"<a href=""http://twitter.com/download/iphone"" rel=""nofollow"">Twitter for iPhone</a>",This is Duddles. He did an attempt. 13/10 someone help him (vid by Georgia Felici) https://t.co/UDT7ZkcTgY,13,10,Duddles,,https://pbs.twimg.com/ext_tw_video_thumb/879415784908390401/pu/img/cX7XI1TnUsseGET5.jpg,1,English_springer,38.34,True,Boston_bull,13.5,True,Cardigan,11.05,True,107956,45849
2017-06-26 16:31:08 +0000,"<a href=""http://twitter.com/download/iphone"" rel=""nofollow"">Twitter for iPhone</a>",This is Jack AKA Stephen Furry. You're not scoring on him. Unless he slips down the slide. 12/10 would happily get blocked by https://t.co/0gOi601EAa,12,10,Jack,,https://pbs.twimg.com/media/DDQsQGFV0AAw6u9.jpg,1,tricycle,66.36,False,Labrador_retriever,3.35,True,Pembroke,1.88,True,17099,3261
2017-06-25 18:56:45 +0000,"<a href=""http://twitter.com/download/iphone"" rel=""nofollow"">Twitter for iPhone</a>",This is Steven. He has trouble relating to other dogs. Quite shy. Neck longer than average. Tropical probably. 11/10 would still pet https://t.co/2mJCDEJWdD,11,10,Steven,,https://pbs.twimg.com/media/DDMD_phXoAQ1qf0.jpg,1,tabby,31.19,False,window_screen,16.91,False,Egyptian_cat,13.29,False,23022,4941
2017-06-25 16:07:47 +0000,"<a href=""http://twitter.com/download/iphone"" rel=""nofollow"">Twitter for iPhone</a>",This is Beau. That is Beau's balloon. He takes it everywhere. 13/10 would protect at all costs https://t.co/YDtpCjIPKN,13,10,Beau,,https://pbs.twimg.com/media/DDLdUrqXYAMOVzY.jpg,1,vizsla,96.05,True,miniature_pinscher,0.94,True,American_Staffordshire_terrier,0.87,True,19317,2812
2017-06-25 00:45:22 +0000,"<a href=""http://twitter.com/download/iphone"" rel=""nofollow"">Twitter for iPhone</a>",This is Snoopy. He's a proud #PrideMonthPuppo. Impeccable handwriting for not having thumbs. 13/10 would love back #PrideMonth https://t.co/lNZwgNO4gS,13,10,Snoopy,puppo,https://pbs.twimg.com/media/DDIKMXzW0AEibje.jpg,2,Italian_greyhound,73.47,True,whippet,15.05,True,Ibizan_hound,3.97,True,19763,4319
2017-06-23 16:00:04 +0000,"<a href=""http://twitter.com/download/iphone"" rel=""nofollow"">Twitter for iPhone</a>","Meet Shadow. In an attempt to reach maximum zooming borkdrive, he tore his ACL. Still 13/10 tho. Help him out below

https://t.co/245xJJElsY https://t.co/lUiQH219v6",13,10,Shadow,,https://pbs.twimg.com/media/DDBIX9QVYAAohGa.jpg,1,basset,32.04,True,collie,21.6,True,Appenzeller,12.85,True,7913,1349
